brand,model,version,year,segment,comment,label
skoda,kushaq,style,2025,suv,"Giá nó còn quá cao so vs thu nhập ng Việt, hy vọng tương lại hãng giảm xún 550 cho bản thấp là đẹp.",negative
skoda,kushaq,style,2025,suv,"Kushaq có Apple CarPlay không dây, kết nối tiện lợi, đúng chuẩn xe hiện đại",positive
mg,zs,luxury,2024,suv,Mua xe cứ theo tôn chỉ: Tiền nào của nấy,neutral
skoda,slavia,style,2025,sedan,"xe quá đỉnh , chuẩn xe châu âu giá cả phải chăng",positive
hyundai,creta,n line,2025,suv,715 nline lăn bánh gần 800 thì Terri trend + CX5 deluxe chặn 2đầu.. Xforce giảm 100% PTB và Yariss giame 50% PTB kẹp 2 bên.. Dù đẹp dù ngon thì cũng no hope.. Hạng B mà lăn bánh loanh quanh 800 thì quá khó..,negative
skoda,slavia,style,2025,sedan,"Xe giá hợp lý ghê, thương hiệu châu âu giá này chắc hơn mấy a vios rồi. Để bữa nào đi lái thử xem.",positive
huyndai,accent,,2024,sedan,giống Elantra,negative
kia,seltos,,2024,suv,nó vẫn không có đèn gầm nhỉ . nhìn chung creta phiên bản 2024 mượt thật,negative
geely,coolray,flagship,2025,suv,An toàn túi khí đầy đủ.,positive
nissan,almera,,2025,sedan,"nissan đi hơi bị ngon luôn , chỉ ít đại lí thôi",neutral
toyota,vios,,2025,sedan,Hybrid vios dành cho nguoi lao dong kinh doanh nhe.,neutral
byd,atto 2,,2025,suv,"em thấy bên trung quốc gặp quả bug, họ cố kéo cái cửa sổ để có kẽ hở rồi ra lệnh nó lại mở thật :V",negative
skoda,kushaq,style,2025,suv,"Con này bản VN có phanh khẩn cấp phía trước, cảnh báo điểm mù, cảnh báo phương tiện cắt ngang phía sau. Khả năng phần cứng là 1 radar trước, 2 radar góc phía sau. 
 Nói chung là đủ cơ bản. 
 Mà có lẫy chuyển số ở vô lăng, làm mát ghế phía trước khá ngon.",positive
vinfast,vf 6,plus,2025,suv,"Chúc mừng bạn, mình thì mua ô tô năm 24t cũng cùng câu chuyện mua nhà hay mua xe cũng đã được Mexe phỏng vấn, trc đi xe xăng là MG ZS đầu năm nay cũng đã chuyển qua VF6s do thấy phù hợp về nhu cầu và nhiều mặt. Ncl khá là hài lòng với xe từ ngoại thất đến nội thất hay hiệu năng và đặc biệt đang được free sạc, xong quyết định của Thủ tướng nữa thì càng thấy lựa chọn đúng đắn. 
P/s: ông bạn cho xin 1 logo Mexe với, trống trải quá, logo cũ gắn trên xe cũ bán mất rồi :(((",positive
geely,coolray,flagship,2025,suv,Toàn đem bản cũ về VN coi thường quá,negative
toyota,corolla cross,v,2024,suv,Nếu có điều kiện với số tiền đó mình mua con CRV.,negative
byd,atto 3,,2024,suv,"Review quá kém, báo xe đi đc 450km nhưng không hề nói đi với tốc độ bao nhiêu, vì tốc độ ảnh hưởng rất lớn đến phạm vi di chuyển của xe điện, như xe E34 công bố đi đc 314km thì phải đi 60km/h mới đạt đc, còn đi 100km/h thì đi đc có 200km, chắc ae này bò 70km/h trên cao tốc 5b mới đc như vậy",negative
nissan,kicks,e-powers,2025,suv,"Bản hiện tại ghế sau hơi đứng k ngã được,vs lại không có bệ tì tay cho nên tui không chọn e nó",negative
skoda,kushaq,style,2025,suv,Xe châu âu mà giá này thì quá tốt,positive
nissan,almera,,2025,sedan,Xe có Suzuki với nissan là 2 samurai cuối cùng của nhật bổn,positive
kia,seltos,,2024,suv,"Chuẩn, không phải đổi thiết kế liên tục là hay mà cũng không phải giữ mãi thiết kế cũ là hay, chứ canh thời gian hợp lý để đổi đỡ bị nhàm chán là được",neutral
mazda,cx-3,1.5 at,2025,suv,nhìn nội thất mình tưởng mazda 2 :)),neutral
geely,coolray,flagship,2025,suv,"Ngoại thất thể thao, mâm xe đẹp, nhưng sơn dễ xước nếu không cẩn thận.",neutral
vinfast,vf 6,plus,2025,suv,Sao rẻ thế,positive
huyndai,accent,,2024,sedan,Các đời trước nhìn rất ok đời này phần đầu xấu quá,negative
toyota,corolla cross,v,2024,suv,Cà rốt ngồi rộng và ổn hơn nha cả nhà . Bề ngoài cũng đẹp hơn CX5,positive
byd,seal 5,dm-i,2025,sedan,"Đắt hay rẻ là phải có tham chiếu để so sánh. 
Civic hev 900 mà con này có 696 là ngon rồi. 
Rồi các bố lại bay vào chê byd sao so được với honda
Cùng giá thì công nhận ko so được, cơ mà rẻ hơn 200tr thì honda tuổi tôm.",positive
vinfast,vf 6,plus,2025,suv,"Ngoài tiết kiệm , lái vui vẻ. Còn k ra gì, hợp dân xe ôm kt",positive
byd,seal 5,dm-i,2025,sedan,Xe BYD quá đẳng cấp hiện nay đứng đầu thế giới về xe điện còn tiết kiệm nhiên liệu nhất,positive
toyota,corolla cross,v,2024,suv,Hộp số CVT yếu,negative
geely,coolray,flagship,2025,suv,"Về ''Con tim'' tôi không ưa xe Tàu khựa , về lý trí cũng không thích vì vòng đời ngắn .",negative
byd,atto 3,,2024,suv,Tất cả đều ổn ngoài trừ thiết kế nội thất,negative
skoda,kushaq,style,2025,suv,Xe nhìn đẳng cấp thế nhỉ. Nhìn cái đám cùng phân khúc thấy là không có cửa rồi đó.,positive
skoda,slavia,active,2025,sedan,t thấy con này ngon hơn City nha,positive
skoda,slavia,style,2025,sedan,"Xe ngon, giá ngon, không kinh tởm như đám xe Vin.",positive
geely,coolray,flagship,2025,suv,Hộp số tự động 7 cấp mượt.,positive
vinfast,vf 6,eco,2025,suv,"phải nói là rất chát, 6s chơ chụi option nhưng giá vẫn cao hơn bản cao cấp nhất của xe xăng đồng hạng, ngồi sau không hơn gì vf5 là mấy, lưng ghế đứng, ngồi xổm.",negative
toyota,corolla cross,v,2024,suv,Cửa sổ trời không phù họp với thời tiết của Việt Nam,negative
haval,jolian,,2025,suv,Với 679 bản full khá tốt,positive
kia,seltos,,2024,suv,"Nhìn mãi mà không thấy cái quan trọng đó là đèn sương mù để chạy xe mùa đông đâu ,",negative
byd,atto 3,,2024,suv,Mình đã lái Atto 3 hơn 3500 km. Không tốn chi phí vận hành nhờ hệ thống năng lượng mặt trời thải ra lượng điện dư thừa. Quãng đường có thể đi được khi lái xe trong thành phố có thể đạt hơn 350 km.,positive
vinfast,vf 6,plus,2025,suv,Mình định mua vf6 mà vẫn sợ không an toàn,neutral
vinfast,vf 6,eco,2025,suv,Tiếng kêu có thể là hệ thống làm mát của máy,neutral
mg,5,std,2024,sedan,"Chạy xe hiếm quá, khai tử rồi thì sau này bảo trì , sữa chữa khó",negative
toyota,corolla cross,v,2024,suv,"Đi phố quá ok, nhỏ tiện bền",positive
honda,hr-v,l,2025,suv,rộng như toyota cross vì thiết kế,positive
toyota,corolla cross,v,2024,suv,Chiếc xe Toy ngáo giá,negative
skoda,kushaq,style,2025,suv,"Skoda Việt Nam ra mắt Kushaq đúng thời điểm, giá tốt, tính năng ngon. Chắc hot dài dài",positive
mg,zs,luxury,2024,suv,Bản std đã có sấy gương chiếu hậu 2 bên. Cái mình tìm mãi không thấy trên xe này là cách tắt AC bằng phím cứng mà không tắt quạt gió khi đang bật đh. Toàn phải đk trên màn hình,negative
toyota,yaris cross,máy xăng,2024,suv,"Yaris nội thất quá xấu, toàn nhựa, camera 360 làm cho có, màn hình rất sơ sài, hiển thị kém. Tầm giá này tôi chọn KIA Seltot",negative
byd,atto 3,,2024,suv,Chỉ lo trạm sạc khi đi xa thui,negative
nissan,kicks,e-powers,2025,suv,Nắp capo làm gồ 2 bên lên thế này giống kiểu Navara thì tầm nhìn khi lái xe khó chịu hơn,negative
kia,seltos,facelift,2024,suv,"Tự Kia + Thaco làm khó mình =)))) dải sản phẩm xe thì con nào cũng ngáo giá, ế toàn phần. Các hãng thì đua nhau giảm sâu nhưng riêng các cụ này thì không, có giảm nhưng ko đáng kể thì bảo sao mất hút hết khách kkkk",negative
mitsubishi,xforce,ultimate,2024,suv,"Đi qua gờ giảm tốc xóc long óc luôn, nhưng bù lại nếu bị sập ổ voi thì vẫn vững vàng",neutral
mg,zs,std,2024,suv,làm lại logo giống kia chắc doanh số tăng liền,positive
mazda,2,at,2025,sedan,So vs giá trị. Thì dòng này mang lại ổn,positive
skoda,kushaq,style,2025,suv,"Xe có phanh tay cơ, cái cảm giá lúc kéo phanh tay rẹt rẹt nó khá phê. Dùng lâu thì thấy trí nhớ cơ bắp + nhìn… sẽ khó quên kéo phanh tay hơn… an toàn hơn.",positive
huyndai,accent,,2024,sedan,Xe đẹp từ trong ra ngoài với giá trên dưới 500tr thì lại càng đẹp.,positive
geely,coolray,flagship,2025,suv,"Động cơ turbo chạy bốc, tăng tốc nhanh, nhưng tiếng máy hơi ồn khi lên tốc độ cao.",neutral
geely,coolray,flagship,2025,suv,"Ghế massage cho lái xe, thư giãn.",positive
skoda,kushaq,style,2025,suv,"Nhìn con xe này cảm giác sang hơn hẳn so với mấy mẫu Hàn, Nhật cùng tầm giá",positive
toyota,corolla cross,v,2024,suv,"bỏ 900tr ra mua cái xe ko có treo độc lập, vl thiệt",negative
skoda,kushaq,style,2025,suv,Skoda là thương hiệu xe hơi của Séc (Tiệp khắc cũ). Nay Volkswagen mua lại!,positive
nissan,kicks,e-powers,2025,suv,Hôm trước đi sửa con xe nissan livina tìm cả thành phố thanh hoá k có chỗ nào bảo dưỡng phải ra ngoài.,negative
vinfast,vf 6,eco,2025,suv,"Mình lái thử công nhận cách âm tốt hơn vf8 tiên phong,chạy đầm chắc phết,mình sd xe ford bmw,nên thấy vf9 lái quá ngon vf6 ngon lái đầm",positive
skoda,slavia,style,2025,sedan,Từ ngày cuộc chiến xăng điện là xe rẻ hẳn,positive
nissan,almera,,2024,sedan,Con này nhìn nó sang hơn Vios. Vios năm nay nhìn cái mồm chán đời.,positive
nissan,almera,,2024,sedan,Mình đã chọn và chốt một em almera bản V.,positive
mitsubishi,xforce,ultimate,2024,suv,Mits đã nâng tầm pr lên 1 tầm cao mới. Bây giờ chắc chỉ có mấy hãng xe tàu mới có thể làm pr xe ngang tầm mits mà thôi,positive
skoda,kushaq,style,2025,suv,Mình thích hộp số 6 cấp và moment xoắn tốt của máy tubor ở xe này. Và đặt biệt giá rẻ hơn hrv của honda .cũng đáng cân nhắc trong phân khúc này.,positive
huyndai,accent,,2024,sedan,Ai chê thì chê mình vẫn thấy e nó ngoại hình đẹp,positive
skoda,kushaq,style,2025,suv,"Giờ chơi chiếc này cũng hay 
 Ít dụng hàng",positive
mitsubishi,attrage,cvt,2025,sedan,"Bảo dưỡng rẻ, phụ tùng dễ tìm",positive
skoda,kushaq,style,2025,suv,Mua CX5 vẫn đỉnh cao hơn :D hahaaaaaaaaa,negative
haval,jolian,,2025,suv,"T Anh cao 1m7 phải k nhỉ, mà đứng với cái xe trông lọt thỏm, trông con xe to phết",positive
skoda,slavia,style,2025,sedan,"Mình không phải nói quá về dòng skoda này nó là công ty ô tô của cộng hoà séc nhưng đã đc volwwagen của đức mua lại , dòng xe này chết lượng khung gầm thân vỏ và động cơ bền bỉ chắc chắn , xe chạy 20 năm k si nhê gì . Hiện tại mình làm việc ở cộng hoà séc chưa đủ yếu tố để về VN nếu về mình sẽ ưu tiên mua skoda bởi vì về chất lượng đặc biệt là giá thì cực kì hợp lí , mọi người đừng có ngại đi ngược số đông . Chẳng qua tại VN ta ngại thay đổi thôi chứ nhiều khi theo số đông nhưng lại không hợp với bạn , hãy mạnh dạn mà lựa chọn sự đunga đắn và hợp lí đi xe ô tô với dân ta vẫn là 1 thứ tài sản lớn nhưng ta nên chua trọng vào sự thực dụng và an toàn để mà xuống tiền",positive
vinfast,vf 6,plus,2025,suv,Đổi từ Veloz qua vf6 thấy quá hài lòng. Lúc mua cũng nhiều người nói nhưng kệ giờ lại thấy mây ông hàng xóm cũng qua xe điện kha khá rồi,positive
vinfast,vf 6,eco,2025,suv,Xe 2 tấn xe lặng hơn xe dầu,negative
mg,zs,std,2024,suv,"Mua xe từ đầu năm 2023 , chưa bao giờ hối hận khi mua MG ZS, quá hợp lý, ổn, rộng rãi trong tầm giá, độ hoàn thiện quá nét , tìm đâu ra con nào hơn con MG Zs , các bác cứ tham khảo, lái thử, rồi đưa ra ý kiến cá nhân của riêng mình, chứ đừng nghe người ta nói",positive
byd,sealion 6,,2025,suv,"Ban đầu khá thích em này, rộng rãi, êm ái, nhưng cuối cùng chốt LC01 do ngoại thất nuột hơn, nội thất cũng bớt sến hơn",negative
geely,coolray,flagship,2025,suv,Xe Geely bền bỉ thời gian.,positive
skoda,slavia,style,2025,sedan,"Con phiên bản đầu nếu lăn bánh với giá 420 triệu thì hợp lý, vì các xe hơn con này nhiều nhưng lăn bánh ở Ấn Độ giá còn thấp hơn nhiều, vì vậy nhà đầu tư cần nghiên cứu kỹ để áp giá ở Việt Nam",negative
mg,5,std,2024,sedan,xe đẹp mà giá cũng đẹp. mua thôi ae,positive
vinfast,vf 6,eco,2025,suv,"mình cũng đang dùng con này màu trắng, ko biết các bác vin 2024 vs vin 2023 thế nào chứ con của mình vin 2025 mới đi được 1 tháng thì lỗi sơn, nẹp loa ở ghế lái thì bung, còn vận hành thì oke. Chắc do mình đen vớ đúng con bị lỗi, được cái chăm sóc của vin khá nhanh và chu đáo, bảo hành sơn 1-2 hôm lại như mới",neutral
skoda,kushaq,style,2025,suv,"phân khúc C con Karoq vừa đắt vừa nhỏ nhất phân khúc. Thà ngta mua Kushaq cũng xêm xêm trong khi tiết kiệm được mấy trăm triệu. P/P Karoq thấp nhất phân khúc, ngược lại P/P Kushaq và cả Slavia cao nhất 2 phân khúc",positive
skoda,kushaq,style,2025,suv,"Tôi đang chạy Skoda Kodiaq.
 Nó chỉ không hiện đại thôi chứ còn tất cả đều tuyệt vời giá chỉ tầm 1ty5 cho 1 chiếc xe mạnh mẽ, an toàn, cảm giác lái tuyệt vời. 
 Riêng tôi thấy mấy bạn đánh giá xe còn chưa nói hết đc những điều tuyệt vời của chiếc xe này
 Đối với tôi 1ty5 sỡ hữu chiếc xe này ở Việt Nam không chiếc xe nào có thể so đc với Skoda kodiaq",positive
geely,coolray,flagship,2025,suv,"Mih đang đi con Attrager nói thật. Chỉ đx cái rẻ. Vỏ thì mỏng tanh. Dàn chân thì mềm nhũn ra. Qua gờ giảm tốc có 30km mà nó muốn văng cái xe qua nơi khác. Máy thì có 3 máy, nó rung và ồn như công nông. Xe trung quốc mà họ lm ăn nghiêm túc ở vn thì xe nhật hàn coi chứ tiêu.",negative
toyota,corolla cross,v,2024,suv,Nói trung H ko thể so đc với ToYota,positive
kia,seltos,,2024,suv,Chưa bao giờ thấy cái đầu xe seltot nó đẹp nhìn đời cũ và mới quá rối mắt.,negative
byd,atto 3,,2024,suv,"Nhìn trên đường rất nổi. Khác biệt đúng chất xe điện, ko như vin thiết kế nửa vời. Ko khác xe xăng và ko cập nhật xu thế",positive
skoda,kushaq,style,2025,suv,Đớt đớt nó khó chịu zô cùng,negative
honda,city,1.5 rs,2024,sedan,"Xe đi cao tốc rất sướng và ga vọt. Ghế sau vk con mình ngồi thoải mái. Nhiều người bảo hơi ồn nhưng phân khúc này mình nghĩ xe nào cũng ồn như vậy, chấp nhận được. Nói chung mua con này không hối hận",positive
hyundai,creta,n line,2025,suv,Hyundai các dòng xe cách thiết kế ko đồng nhất ngôn ngữ,negative
byd,sealion 6,,2025,suv,Giá cao quá. 799trieu thì chờ 1 năm nữa ế sẽ hạ còn 715 triệu,negative
kia,seltos,facelift,2024,suv,"Xe Nhật từ 1.5T -> 1.5, giảm 70tr. 
Xe Hàn từ 1.4T -> 1.5, tăng 50tr =))",negative
skoda,slavia,ambiton,2025,sedan,Sao bản thấp nhìn mâm nó đẹp và hợp thân xe hơn bản cao cấp nhỉ,positive
skoda,slavia,style,2025,sedan,Thèm lắm mà chỉ biết ước,positive
huyndai,accent,,2024,sedan,Phải nói là phong cách thiết kế của lux a với lux sa nó lại rất hợp với nhiều năm về sau,positive
geely,coolray,flagship,2025,suv,Nội thất LED chiếu sáng.,positive
toyota,corolla cross,v,2024,suv,Mặc dù sở hữu Tucson nhưng mình đánh giá rất cao Cross ở khoản đi phố. Treo thanh xoắn của Cross ngồi rất êm và nhẹ nhàng ở giải tốc độ thấp đến vừa phải,positive
nissan,almera,,2024,sedan,Nisan là ok rồi.. thương hiệu từ xưa tới giờ,positive
haval,jolian,,2025,suv,Đang đi CX30. đang tính năm sau đổi xang xe tàu mà xe nào cũng thấy thú. Nhất là J7 và con jolion này,positive
mitsubishi,attrage,cvt,2025,sedan,"Nội thất nhựa cứng nhưng sạch sẽ, lau 1 cái là đẹp ngay",neutral
skoda,kushaq,style,2025,suv,"Vô lăng trợ lực điện, lái nhẹ.",positive
vinfast,vf 6,eco,2025,suv,"Đi nhờ 1 hôm mà khiếp, lốp mỏng ồn sóc, ngồi sau như ngồi xổm ngồi trong ko khác madaz 3 ngồi lâu khó chịu hơn, mua con xfor cho nó thoáng.",negative
nissan,almera,,2024,sedan,Đồ thay chát lắm =)),negative
mg,5,luxury,2025,sedan,Chúa tể thùng tôn di động,negative
huyndai,accent,,2024,sedan,Đẹp và hợp lý,positive
skoda,kushaq,style,2025,suv,"Động cơ yếu quá nhỉ, này đi loanh quanh phố thôi",negative
kia,seltos,facelift,2024,suv,Hơn 800 thì chọn CX5 hơn nhiều,negative
mg,zs,std,2024,suv,Xe trung quốc ít có đối thủ cạnh tranh về giá,positive
mazda,2,at,2025,sedan,"Khen được con MD2 thì đúng chịu, bản thấp nhất nội thất như chuồng gà, qua chật chội để đi gia đình, giá thì cao, cái đáng giá nhất chắc là động cơ Skyactive trứ danh của Mazda, còn lại hỏng toàn tập",negative
mg,5,luxury,2025,sedan,"giá xe bên trung quốc công nhận rẻ thật, hơn 200tr mà ko thiếu cái gì",positive
nissan,almera,,2024,sedan,"Đang đi nissan sunny mà thấy nissan ok mà, mỗi tội khâu maketing kém quá",neutral
honda,city,1.5 rs,2025,sedan,giá trị trên giá tiền thì honda city số1 hạng B,positive
huyndai,accent,,2024,sedan,Mẫu cũ đẹp hơn mẫu 2024 quá xấu,negative
geely,coolray,flagship,2025,suv,Tiếng máy êm ru.,positive
geely,coolray,flagship,2025,suv,Động cơ mạnh mẽ.,positive
vinfast,vf 6,eco,2025,suv,Vẫn ế thôi,negative
huyndai,accent,,2024,sedan,"Con này ngon, bổ, rẻ. Không biết Elantra 1.6 sẽ bán cho ai nữa.",positive
mitsubishi,attrage,cvt,2025,sedan,"Xe Nhật nên khách hàng tin tưởng, bán lại nhanh",positive
honda,city,1.5 rs,2025,sedan,Chê mỗi cái cần gạt số xấu đồng hồ cơ nếu cái thiện được như accsent thì ngon đúng nghĩa,neutral
nissan,almera,,2025,sedan,"Chiếc almera này đi xa mới thấy được giá trị của nó, đi vài trăm km cả gia đình khoẻ k mệt mỏi... xe êm, cách âm tốt, điều hoà dễ chịu và quá tiết kiệm xăng lại bền bì, khung gầm vỏ ăn đứt các con khác cùng phân khúc",positive
honda,city,1.5 rs,2025,sedan,Xe này ngoài quá ồn thì chẳng có gì để hỏng,neutral
byd,atto 2,,2025,suv,"Xe BYD điện tạm thời chỉ bán cho tập khách hàng giàu có ( nhà có garage, nhiều xe hơi, mấy người giàu này không đi xa bằng xe điện). Năm sau khi nhiều trạm sạc dùng chung thì mới nhiều người mua. Lúc đó BYD cũng thành quen thuộc",negative
geely,coolray,flagship,2025,suv,Tiếng đóng cửa chắc chắn.,positive
vinfast,vf 6,plus,2025,suv,"Adas của VF6 là ngon nhất trong đám hạng B rồi, đầy đủ mọi thứ chứ không thiếu này thiếu nọ như adas giả cầy của các hãng.
Buồn cười nhất là quả ACC chạy bằng camera của hãng T, mưa to phát khỏi dùng luôn",positive
mg,5,std,2024,sedan,400 tr mà mấy bố làm như 40tr . Toàn mấy thánh chả biết có đủ điều kiện mua xe ko phán . Tôi nói thật mua xe tầm tiền này đa số toàn những gia đình không khá giả lắm .Co khi phải vay mượn . Trả góp mới mua được. Mức 9l/100 km là quá tốn . Rồi thì xuống cấp nhanh …vv . Tổng kết lại đừng có mua xe tầu nếu kinh tế chỉ ở mức trung bình thấp . Cứ xe nhật xe hàn mà mua . Ưu tiên những dòng xe phổ thông . Tiết kiệm nhiên liệu chạy cho nó lành .,negative
kia,seltos,facelift,2024,suv,Kia dạo này bị phê thuốc hay sao mà ngáo giá thấy ớn,negative
vinfast,vf 6,plus,2025,suv,Thấy giá rất hợp lý,positive
mg,zs,std,2024,suv,"Đầu tháng 1 tôi cũng ra showroom xem chiếc MG zs định múc luôn, vì đang đi sedan tính lên gầm cao. Ra thấy con MG5 std cũng nhảy lên lái thử, quào, rẻ hơn, cùng cái máy mà con mg5 chạy bốc hẳn, cảm giác chạy thích thật sự, đầm chắc, ko bị cảm giác hiu hiu như mấy chiếc gầm cao. Thế là múc luôn con MG5. Thế mới thấy mỗi loại xe nó có cái ưu nhược riêng, chứ cứ nghe trend gầm cao chưa hẳn đã hay. Ae cứ nên đi lái thử, sờ thử cảm nhận chất lượng.",positive
toyota,corolla cross,v,2024,suv,Mình không hiểu sao mình vẫn thích cái phom này . Hay mình độ tuổi 47 t lại thích phom hơi đứng tuổi vậy ha,positive
skoda,slavia,style,2025,sedan,Bỏ cái cửa trời và nút điều hoà cảm ứng đi thì tốt hơn.,negative
mg,zs,luxury,2025,suv,"Điều hòa 2 dàn lạnh, hàng sau mát lạnh",positive
vinfast,vf 6,,2024,suv,Cái nổi bật nhất của vf6 mà gần như ko 1 chiếc xe hạng B nào có là hệ thống treo sau là độc lập đa liên kết chứ ko như các xe hạng B khác toàn là treo dầm xoắn phụ thuộc thì ad lại ko nhắc đến,positive
mazda,cx-3,1.5 luxury,2025,suv,Ngang bản Dulex 2024,neutral
haval,jolian,,2025,suv,Mâm xe chạy nhìn đẹp quá.,positive
geely,coolray,flagship,2025,suv,Giá trị đầu tư tốt.,positive
byd,sealion 6,,2025,suv,"Ngon rồi, làm thương hiệu, chăm sóc khách hàng trước và sau bán hàng tốt nữa là ok.",positive
geely,coolray,flagship,2025,suv,Hộp số tốt.,positive
mg,zs,luxury,2025,suv,"Màn hình 10 inch to, camera 360 nét, đỗ xe dễ",positive
skoda,kushaq,style,2025,suv,"Đã từng trải nghiệm nhanh e này ở triểm lãm Hạ Long, xe âu nên chất lượng rất ngon nhé các bác. Khung gầm chắc chắn, thương hiệu mới ở Việt Nam chứ thương hiệu trên thế giới hơn 100 năm rồi. Giá này kiếm đâu được em châu Âu lại ngon vậy",positive
toyota,corolla cross,v,2024,suv,Mua con này thà mua seltos còn hoen,negative
honda,hr-v,g,2025,suv,"Tôi là chủ xe của HRV G. Mức tiêu hao 6,7lít/100km là phù hợp nhé",positive
mg,zs,std,2024,suv,"Chỗ cốp có 2 thanh nhựa kìa, nâng miếng cốp lên thanh đó là thẳng cốp",positive
mitsubishi,attrage,cvt,2025,sedan,"Xe không có ADAS nhưng phanh ABS tốt, phanh gấp rất ăn",positive
mazda,cx-3,1.5 at,2025,suv,"Xe này ngon mà; mình đag đi bản luxury có cửa sổ trời, vật liệu nội thất đến 90% là da rồi; các hệ thống tự động, thanh giá nóc, ốp body cũng làm xe đẹp hơn. Quan trọng là nó kiểu khác biệt, thể thao, linh hoạt và đầm chắc do là xe nhập thái.",positive
byd,atto 3,,2024,suv,5p sạc dc hơn 400km quá khủng cho nhà byd,positive
skoda,slavia,ambiton,2025,sedan,"nhìn khung của xe đã đủ xuống tiền rồi, chưa kể bên trong còn hơn hẳn nhà Daihatsu",positive
huyndai,accent,,2024,sedan,Tuyệt vời so với phiên bản trước,positive
omoda,c5,,2024,suv,Hy vọng qua năm rẻ hơn chút để tậu 1 em,negative
vinfast,vf 6,eco,2025,suv,Vf5 vf6 ông khen đẹp thì đến ạ mắt ông rồi,negative
nissan,kicks,e-powers,2025,suv,"Nissan ở Vn tậm tịt kinh khủng, loanh quanh có mỗi 3 con xe navara, almera với kicks không có một chiến lược về phân khúc, người dùng gì cả cứ rời rạc. Mà ng Vn chính ra cũng ưa Nissan mỗi tội phân phối chán.",negative
byd,sealion 6,,2025,suv,"Sau khi xem chiếc clip khá chi tiết chủa tip car, thì ý kiến cá nhân của mình về em này "" Chất lượng nội ngoại khá chắc chắn trông không bị ọp ẹp có thể nói khá cao cấp độ hoàn thiện tốt. Hiệu năng về công suất khá,"" Và thứ mn băn khoăn chỉ có về độ bền... Cái gì TQ làm tốt thì phải thừa nhận, chỉ băn khoăn về cái cốt lõi thôi.",positive
honda,city,1.5 rs,2025,sedan,"chờ bản này về thôi , ngon",positive
huyndai,accent,,2024,sedan,Ai chê chứ e thấy phân khúc với giá tiền vậy là đẹp,positive
nissan,almera,,2024,sedan,Đại lí ít và tính thanh khoản thấp là 2 thứ đau đầu nhất đối với phần lớn tệp khách hàng ở hạng B này khi chủ yếu là miếng cơm manh áo hoặc gia đình trẻ ít tiền :)),negative
mg,5,std,2024,sedan,Thiết kế cũng đẹp phết mà,positive
skoda,kushaq,style,2025,suv,"Cho mình hỏi chi phí bảo dưỡng nó ngang với xe nào vậy ạ, có đắt ko",neutral
omoda,c5,,2024,suv,"Sao có ông bảo treo mềm, ông bảo treo cứng nhỉ",negative
vinfast,vf 6,eco,2025,suv,Thiết kế u ngi thật,negative
mg,zs,luxury,2024,suv,"Xe này hạng B nhưng giá chỉ bằng xe hạng A của Hàn,Nhật thôi,so sánh phải so sánh cùng giá tiền chứ",positive
