brand,model,version,year,segment,comment,label
hyundai,creta,n line,2025,suv,"Bản N line thiết kế đặt logo trước lệch xuống dưới mất cân đối, xấu hơn các bản còn lại",negative
vinfast,vf 6,,2024,suv,"Mình ngồi xe vin . Mình thấy thân vỏ dày dặn chắc chắc .nhưng sao cái gầm xe cảm giác nó hơi yếu . Đi thẳng thì không sao đánh lái nó hơi nhẹo nhẹo . Nhiều người nói do thụt mềm nhưng mình nghĩ không phải vì thấy đi qua ổ gà cũng bình thường , mình không phải dân kỹ thuật nên cũng không hiểu vấn đề ở đâu .",neutral
kia,seltos,,2024,suv,K biết có về việt Nam k nhỉ ! Mẫu này về là lại lên top luôn,positive
huyndai,accent,,2024,sedan,Hi vọng đời này ko còn lỗi trục lái và cửa nữa,neutral
toyota,corolla cross,v,2024,suv,"Toy định giá quá cáo, nếu nhu cầu đi đô thị và không cần đến không gian rông, giá lăn bánh HN tầm 800 thì Cross lại là số 1. nhưng bỏ ra hơn 900 để lăn bánh Cross ở HN đúng thật chỉ có người phải yêu Toy nhiều lắm mới đủ dũng cảm xuống tiền, chứ tầm tiền đó tội gì mua Cross.",negative
geely,coolray,flagship,2025,suv,"con này treo siêu cứng luôn
 đi thử qua gờ giảm tốc rất khó chịu, k được êm ái
 bù lại được cái khung gầm cứng, của tốc độ cao ok.
 hoàn thiện nội thất k được ok lắm, mấy cái tay nắm cửa lỏng lẻo, cửa gió điều hòa phía sau đặt ở dưới gầm ghế hàng ghế đầu.
 tóm lại
 Ưu điểm: ngoại thất thể thao, bodykit, khung gầm cứng cáp, động cơ turbo
 Nhược điểm: treo cứng, k thoải mái, chất lượng nhựa lỏng lẻo (cả phần bodykit phía đầu xe), điều hòa ghế sau chưa công thái học.
 Chưa kể bản base phải gập gương bằng cơm, k có camera 360, ...
 Cùng tầm tiền bản base có thể cân nhắc Omoda c5 lux (thua mỗi động cơ không có turbo)",negative
vinfast,vf 6,,2024,suv,"Chỉ cần thay hàng ghế sau không ngồi xổm, ngồi đàng hoàng ngang với những xe cùng tầm giá thì CHỐT LUÔN. Kh cần voucher !",neutral
haval,jolian,,2025,suv,"Xe tốt, giá tốt nhưng ít quảng bá và ít đại lý quá",positive
geely,coolray,flagship,2025,suv,"thôi xạo lol bớt bớt đi mày, dkm mày, mày ăn tiền của hãng xong rồi xoay qua lùa dân Việt vào rọ à? Xe Tàu ,động cơ dung tích 1.5 lại dùng turbo ,Mày chạy 100km/h mà mày bảo chưa đến 5l/100km. Tao cũng dùng nó dc mấy tháng rồi đây đâu phải chỉ mỗi mình mày có .hàng ghế sau thì đi xa ngồi thì khổ như lợn trong rọ,điều hòa kém mát, hết công suất quạt nhưng hàng ghế sau vẫn nóng (tao ở miền nam) xe này theo tao thì ổn hệ thống treo, hệ thống lái còn kém về điều hòa và hàng ghế sau ngồi đường xa thì khóc,xe ồn hơn các xe tao đã lái .Hãng này mới nên sau vài tháng mua xe bên bộ phận sale sẽ đt cho những khách hàng đã mua xe này bảo họ quay video đánh giá và đăng công khai rồi hãng sẽ trao quà là tặng phẩm với tiền mặt,nên muốn có tiền thì khen nhiều chê ít. Tôi cũng đang dùng xe này nên tôi hiểu rõ.thằng này nó xạo lol để lùa gà vào rọ",negative
mazda,2,at,2025,sedan,Tôi thích chiếc xe này. AT mà giá mềm. Chạy cũng tiết kiệm,positive
geely,coolray,flagship,2025,suv,ưng mắt thế nhỉ,positive
skoda,slavia,ambiton,2025,sedan,thích nhất combo : Sedan mà gầm lại khá cao. 178mm,positive
kia,seltos,,2024,suv,"Đổi mẫu cũng hợp lý, nhìn cái mẫu cũ 4 năm rồi cũng hơi chán",positive
nissan,kicks,e-powers,2025,suv,"Bản 2025 mà về VN thì mình đặt cọc liền , quá đẹp .",positive
skoda,kushaq,style,2025,suv,Xe Skoda là hẵng xe Cz Được VW-Audi mua lại.tôi thấy ở Đức cũng thấy họ mua loại này cũng nhiều,positive
toyota,corolla cross,v,2024,suv,Gần nhà mình thường có 2 chiếc này đỗ cạnh nhau. Nhìn bên ngoài đúng như bố với con. Con cx5 trông to nạc hơn hẳn. Phải yêu Toy lắm mới mê nổi với cái giá này,negative
skoda,slavia,style,2025,sedan,"Giá qá ổn cho 1 con xe Châu Âu, hãng lâu đời, đúng kiểu xe chú trọng an toàn cho ng ngồi trên xe. Dự là sẽ chạy đầy đường trong thời gian tới. Nghe nói bảo dưỡng cũng ổn áp lắm cả nhà, 7-8000km mới bảo dưỡng 1 lần. Mức tiêu thụ nhiên liệu bao nhiêu v ạ???? Ai cho y kiến nếu biết nhé",positive
geely,coolray,flagship,2025,suv,Màu bạc tinh tế.,positive
toyota,vios,,2025,sedan,Vios toàn xe cho trung tâm lái,neutral
skoda,kushaq,style,2025,suv,"Đã xem test chiếc xe này, quả thực là nó khác biệt, chất lượng vẫn ra chất xe Châu Âu, khung gầm chắc, cách âm tốt, lái ổn.",positive
skoda,kushaq,style,2025,suv,"Thiết kế Kushaq đậm chất châu Âu, sắc nét từng đường nét. Chờ lái thử xem cảm giác thế nào",positive
toyota,vios,,2025,sedan,"6:22 - ""Thứ duy nhất hỏng trên cái xe là đèn báo lỗi động cơ, vì nó đ bao giờ sáng cả""",negative
vinfast,vf 6,,2024,suv,"tất cả dòng xe Vinfast từ VF6, VF7, VF8, VF9 nên xây lại phần đầu xe, trông tổng thể phần thân xe và đuôi xe nhìn rất đẹp luôn qua tới phần đầu xấu thật sự, nhìn như mấy xe đầu thập niên 2000 vậy, đầu xe con VF8 lúc nào cũng làm tôi trông giống con L200 2007 của Mít su, thứ 2 là logo xe thiết kế đặt vào trông không hợp, nhìn logo của wolfwagen đi, cũng có nét tương tự nhưng họ đặt vào xe nhìn rất đẹp chữ V thiết kế quá đơn giản nhìn không hợp với chiếc xe chút nào",negative
nissan,kicks,e-powers,2025,suv,Chủ thớt chẳng hiểu gì về việc nissan thất bại ở thị trường VN cả. Vấn đề ko phải là sản phẩm mà là vì hãng ko mặn mà thị trường VN giống thằng Suzuki. Nên sản phẩm có tốt đến mấy cũng chẳng thể bán được với cái thái độ hời hợt coi thường khách hàng như thế cả.,negative
mitsubishi,attrage,cvt,2024,sedan,chỉ cần nhìn kiểu dáng với cục máy là không thèm để ý,negative
skoda,kushaq,style,2025,suv,"Phải vào nhà máy lắp con xe này mới biết nó chất lượng như nào. Mình đã chạy thử cả chiếc này và slavia, hai con đều rất chắc chắn, lái tin tay. Nhưng bản thân mình thích con Slavia hơn, nó thấp nên ổn định hơn. Điểm trừ duy nhất chắc là ngoại hình nhưng nếu chọn màu tối như xám và đen thì trông cũng ko đến nỗi.",positive
geely,coolray,flagship,2025,suv,"Nếu ai dám vượt qua định kiến tìm hiểu và lải thử Coolray 1 lần, tôi đảm bảo sẽ phải suy nghĩ lại.Một thương hiệu uy tín, một dòng xe đảm bảo thì tại sao mọi người ko thử. Đây là dòng xe nhập nguyên chiếc từ Malaysia và đã được công nhận ở các thị trường khác trước khi về VN.",positive
toyota,vios,,2024,sedan,mẫu mới đẹp qá,positive
nissan,almera,,2024,sedan,"Động cơ 1.0L Turbo phải như trên Hyundai Venue mới là khỏe, mạnh ngang 1.5L luôn.",positive
geely,coolray,flagship,2025,suv,"xe này 
 3 máy turbo
 hít xăng kha khá
 Malay sia đi rùi",negative
skoda,slavia,style,2025,sedan,Cũng được. Nhưng xét về tổng thể . Tất cả các yếu tố thì city vẫn là con xe ngon nhất trong phân khúc.,neutral
skoda,kushaq,style,2025,suv,"Lấy hơn hai tháng. Ngoài ga thốc máy hơi gào, cam sau tệ. Còn lại thấy đáng tiền bỏ ra, thấy được sự tử tế mà hãng dành cho khách hàng",negative
toyota,vios,,2025,sedan,Mẫu xe City đẹp hơn mẫu Vios rất nhiều,negative
geely,coolray,flagship,2025,suv,Vô lăng da thật cầm chắc.,positive
huyndai,accent,,2024,sedan,đẹp đấy nhìn tối giản giá cả hợp túi tiền,positive
skoda,slavia,style,2025,sedan,5-6km/100 cây :))) giật cả mình,positive
honda,hr-v,l,2025,suv,"Cốp điện, ghế điện, vô lăng, lanewatch, 2 túi khí, 2 loa, sạc ko dây.",positive
vinfast,vf 6,,2024,suv,"Tui ở SÀI GÒN, nói thật là khoảng 300 cái xe xăng thì may ra mới thấy 1 cái xe điện của Vinfast( biển số trắng nhá ). Có khi cả ngày chả thấy chiếc nào . Chứng tỏ chả ai mua xe điện VF cả . Còn xe điên GSM thì quá trời . Không biết ngoài Hà nội thì tỷ lệ xe xăng / điện ( biển trắng ) ra sao hả bác Tipcar",negative
skoda,kushaq,style,2025,suv,"Base 589 thì tụi xForce Creta sao thở được
 Cho em hỏi hàng 2 với cốp rộng rãi không anh Kenz",positive
skoda,kushaq,style,2025,suv,Sao ko phải là 1.4 turbo nhỉ,negative
mg,5,luxury,2025,sedan,Bệnh màn hình lag của nó có khắc phục chưa á,negative
toyota,corolla cross,v,2024,suv,"Mình đã lái thử em này trong một đoạn ngắn ở đại lý, sao thấy tay lái nó nhẹ quá hay tại trải nghiệm chưa đủ lâu với em nó nhỉ.",negative
geely,coolray,flagship,2025,suv,Xe gì 1.5 mà có 3 động cơ. Cố tý làm con xe Nhật.,negative
hyundai,creta,n line,2025,suv,Có thêm cốp điện cảnh báo điểm mù nữa là ngon,neutral
honda,city,1.5 rs,2025,sedan,"City sẽ là chiếc xe đáp ứng nhiều tối ưu nhất trong phân khúc!  Fom đẹp, máy khỏe, vận hành và phụ tùng sẵn rẻ! Vios là vị trí số 2...bền lành, tiết kiệm xăng tôi chỉ chê hệ thống treo rotuyn của vios thôi......acent thì mình thấy kém hơn 2 anh em đến từ Nhật",positive
geely,coolray,flagship,2025,suv,Kể cả xe mới tinh thì tiếng gió rít cột A rất rõ. Trước mình đi thử xe không ưng ở điểm này với cả điều hòa yếu và tốn xăng quá,negative
honda,city,1.5 l,2025,sedan,ci ty ban L khg co ty tay ghe sau - kem xe vios,negative
skoda,slavia,style,2025,sedan,Xe ngon là ngon. Có showroom gần nhà cứ thế mà xuống tiền. Xe quá đã,positive
byd,sealion 6,,2025,suv,"E đã ngồi trải nghiệm một số xe BYD bên Thái, cảm nhận ban đầu là về ""chất"" có thể nói là vượt trội so với xe phổ thông cùng phân khúc khác tại VN chúng ta",positive
huyndai,accent,,2024,sedan,"rộng hơn, mạnh hơn bản cũ là mê rồiii",positive
skoda,kushaq,style,2025,suv,"ko biết các bác lái xe thích công nghệ ntn nhưng e thấy đi xe phanh tay cơ vật lý, các nút điều chỉnh cơ học nó vẫn mang lại cảm giác mộc mạc an tâm thực dụng hơn là màn hình cảm ứng rất nguy hiểm khi vừa lái xe vừa thao tác nhiều khi chạm mãi không được",negative
vinfast,vf 6,,2024,suv,"Theo em thấy thì trong tầm giá 900 triệu đổ lại thì VF6 ( bản plus) là chiếc xe có chất lượng cao nhất. Tất cả các thông số từ sức mạnh, trang bị an toàn, công nghệ trợ lái đều vượt trội so với các xe khác.
Nhưng mà nếu chọn mua thì em sẽ chọn 1 chiếc Kia Carens 1.4 hoặc Honda BRV L chứ không bao giờ chọn VF6. Mặc dù 2 con này thua VF6 trên hầu hết mọi thông số !",positive
skoda,slavia,style,2025,sedan,Gầm cao như này quá ok,positive
mg,5,luxury,2025,sedan,"Thật sự mình không hiểu, đã làm được chiếc xe như vậy rồi mà sao để cái màn hình cứ bị lag lag. Chiếc điện thoại giờ khoảng 3triệu là đã rất mượt rồi",negative
nissan,kicks,e-powers,2025,suv,"Ưng mắt vẻ ngoài, còn nội thất bố trí xem chừng chưa ưng mấy, nhưng pk B thế là ngon lắm rồi",neutral
geely,coolray,flagship,2025,suv,Option gương chống chói.,positive
honda,city,1.5 rs,2025,sedan,E vừa quất xong cảm giác nó đầm nói chung là ưng,positive
toyota,corolla cross,v,2024,suv,Nhưng gầm thấp quá,negative
skoda,kushaq,style,2025,suv,Tiết kiệm xăng hơn xe Hàn.,positive
skoda,slavia,style,2025,sedan,"Cột A quá lớn và không có Cam 360 theo xe , rất bất tiện khi đi phố … nhất là đối với chị em và lái mới …",negative
kia,seltos,facelift,2024,suv,Ngáo giá,negative
skoda,kushaq,style,2025,suv,"Ai khen thì khen, nhưng chỉ cần mấy ông thợ bên gara ô tô chê con này thì coi như mọi ưu điểm vượt trội của nó sẽ biến mất ngay lập tức !",negative
toyota,yaris cross,máy xăng,2024,suv,"Con này nhìn đẹp thật đấy, đẹp nhất hạng B là chắc",positive
skoda,slavia,ambiton,2025,sedan,"2022 lăn bánh con City RS 700tr.. mà con Skoda này ghế điện 2 bên, cửa sổ trời . hộp số AT . làm mát ghế :face-purple-crying:, dã man thật,,, người Việt mình bị bọn Nhật nó lùa cho hàng chục năm trời",positive
byd,sealion 6,,2025,suv,"Giá rẻ hơn VF7 plus vài chục mà full cảm biến trước sau, kính sau kính tối, ghế chỉnh điện đầy đủ... nhưng độ an toàn, động cơ xăng và khả năng tồn tại của BYD trên Việt Nam lại cần thời gian chứng minh. Còn pin thì cell-blade của BYD hiện tại đi trước thế giới hơn 10 năm rồi. Công nghệ pin tàu hiện tại là trùm thế giới thì không bàn cãi rồi.",positive
vinfast,vf 6,,2024,suv,"Trước em đi thử e34, độ ồn cũng không ưa nổi 🫣 giờ xem vf6 thấy mic bác thu cũng khá ồn chứ không êm như em kỳ vọng",negative
skoda,kushaq,style,2025,suv,Nhà máy nên làm 1 đoạn đường bê tông như làng quê VN thì mới biết nó ồn như thế nào,negative
skoda,slavia,style,2025,sedan,Xe này gập đc trải nêm làm 2 tấm lớn nhỏ xàn phẳng cho phụ nữ trẻ em lằm đc khi chạy bắc Nam,positive
mg,5,std,2024,sedan,xe tàu mua j,negative
huyndai,accent,,2024,sedan,huyndai nên sa thải đội ngũ thiết kê hiện tại ra con xe nào xấu con đó ngày càng thất vọng,negative
mitsubishi,attrage,cvt,2024,sedan,E đi taxi ngồi con attrage này cảm giác ko có mùi say xe như những dòng khác. Có ai cảm nhận dc như vậy ko ạ,positive
skoda,slavia,style,2025,sedan,Nhìn xịn xò hơn hẳn,positive
toyota,vios,,2024,sedan,Bản G vip mà chơi. Tội j phải khổ.,positive
toyota,corolla cross,v,2024,suv,Có thêm lẩy chuyển số thì quá ok luôn...,negative
toyota,yaris cross,máy xăng,2024,suv,Bản Hybrid đã khắc phục cơ bản các nhu cầu của chủ tút. Xe đi chỉ 4l/100km. Nhưng về P sợ hỏng hộp số quá...,neutral
honda,city,1.5 rs,2025,sedan,gầm quá thấp!,negative
kia,seltos,facelift,2024,suv,Giá này hơi chát nhỉ. 800tr nhiều sự lựa chọn hơn.,negative
kia,seltos,facelift,2024,suv,"Chết vì ngáo giá.
 Đợt mới ra giá như vậy là hợp lí. Vài lần chỉnh sửa cứ tăng dần dần lên, xong bân cao hẳn. Trong khi về sau càng nhiều xe cạnh tranh đẹp, ngon lành hơn.
 Ế là đúng",negative
mitsubishi,attrage,cvt,2024,sedan,"Con này công nhận ồn thật, đi cao tốc ồn lốp nó dội vào tai rất khó chịu. Mình là khách quen của 1 ông chạy xe dịch vụ, ông ấy kể, khách cần đi gọi xe toàn nhắn lên nhóm là không đồng ý i10, morning vì ngồi chật, còn attrage thì bị từ chối vì cái tội vừa yếu vừa ồn.",negative
mg,5,std,2024,sedan,"e tài chính hạn hẹp , con này giá hợp lí quá , nhưng mọi người cứ bảo xe tàu , với nhanh tã vs chi phí linh kiện nó đắt nên phân vân quá bác ạ , chứ giá ấy quá hợp lí.Không biết có nên mua ko ạ ?",positive
byd,sealion 6,,2025,suv,Mẫu đẹp+ thực dụng giữa điện và xăng+bầu trời công nghệ= vô đối,positive
geely,coolray,flagship,2025,suv,"Treo sau đa liên kết, ổn định.",positive
geely,coolray,flagship,2025,suv,"Đã chạy thử. Chạy quá thích luôn. Máy rất bốc và mượt. Chất lượng hoàn thiện rất ok, nội thất khá đẹp và tiện dụng, thiếu mỗi cửa gió điều hòa ghế sau chứ không là hết nước chấm. Nói chung ngoài việc nó là thế hệ cũ với lại thương hiệu mới ra thì nó ăn đứt hết đám CUV hạng B ở Việt Nam trong tầm giá 700tr quay đầu luôn á",positive
geely,coolray,flagship,2025,suv,Sau bao ngày tháng cày view cho các bác thì hôm qua em đã chốt bản flaship cho xe lần đầu của mình!,positive
toyota,yaris cross,máy xăng,2024,suv,Với giá hiện tại thì yaris cross thuần xăng sẽ so sánh với creta đặc biệt. Mà công nghệ trên creta đặc biệt lại thua yaris cross thuần xăng,positive
mitsubishi,xforce,ultimate,2024,suv,Mình chỉ thấy cái tiếng điều hoà khi bật máy lên nó rú mạnh quá.nó êm tí nữa là quá tuyêth,negative
honda,hr-v,g,2025,suv,"Hrv bên úc bản cao nhất đắp full option giá vẫn rẻ hơn ở vn 9 triệu, có thể rẻ hơn ít nhất 20tr nếu biết trả giá",positive
skoda,kushaq,style,2025,suv,Tôi đang chạy Kodiaq cũng được 2 vạn km nói chung khó có cái gì để mà chê,positive
toyota,corolla cross,v,2024,suv,Sao hàng 2 con này chật hơn Vios thế nhỉ,negative
geely,coolray,flagship,2025,suv,Giá xe ổn định không tăng.,positive
skoda,kushaq,style,2025,suv,"chiếc này ở việt nam khó bán, không phải vì nó không ngon, mà nó ngon ở cái chỗ ng Việt không thích lắm =))",negative
honda,city,1.5 rs,2025,sedan,"Đang chạy City. Nhận xét chung là hài lòng với giá tiền bỏ ra, đi cao tốc khá nhàn do có sensing, cảm giác vần volang nhẹ nhưng đầm chắc. Cái không thích là khá ồn, tiếng lốp vọng vào nghe rõ, bực mình nhất là kết nối bluetooth với điện thoại khó quá.",positive
toyota,corolla cross,v,2024,suv,"Con Cross VN bằng giá con Rav4 ở Trung Quốc, cay thật.",positive
mg,zs,luxury,2025,suv,"Giá khuyến mãi còn giảm thêm, đặt ngay",positive
byd,sealion 6,,2025,suv,Dàn treo thảm hoạ. Khung gầm như xe đồ chơi. Gọi VF bằng cụ tổ,negative
mg,zs,luxury,2025,suv,"Ghế lái chỉnh điện 6 hướng, ngồi thoải mái",positive
mg,5,std,2024,sedan,"Trong số các hãng Tàu thì mình đánh giá cao MG nhất.
Giá rẻ, tiện ích mang lại trên số tiền bỏ ra rất hợp lý.
Đại lý cũng khá nhiều ở TP theo như mình thấy, ko kiểu đem con bỏ chợ như mấy hãng Tàu khác.
Cũng vào VN khá lâu, search youtube chiếc xe đầu tiên được review cũng 3 năm rồi, chưa thấy có vụ phốt hay drama gì.
Nếu giữ tốt phong độ trong vài năm tới thì người tiêu dùng sẽ dần xoá bỏ định kiến như xe Hàn cách đây 20 năm trước.",positive
mitsubishi,attrage,cvt,2024,sedan,"Tôi có em 2017 MT đến nay vẫn ổn ko có gì hư hỏng cả, chị mòn lốp thay lốp, mòn bố thắng thay bố thắng, bảo dưỡng rẻ, ít hao nhiên liệu, điều hòa thì mát sâu, rộng rãi hơn cùng phân khúc. Ai chê cứ chê chứ tầm giá đó hơn nhiều loại khác",positive
byd,atto 3,,2024,suv,Nhìn ngoài con này thực sự rất đẹp nha,positive
vinfast,vf 6,plus,2025,suv,"VF7 quãng đường dài hơn VF6 đó em. Anh cũng đi VF6 plus đây. Đi Đà Lạt thì bao phê, trời lạnh, đường đèo dốc đi 500km được luôn. ",positive
skoda,kushaq,style,2025,suv,"xe này nếu giá thấp hoen chút xíu so với HRV, Xforce, Crera thì sẽ hút khách ngay",negative
vinfast,vf 6,eco,2025,suv,"Con này lỗi bơm,kêu to như máy cày",negative
skoda,kushaq,style,2025,suv,"Cái kẹp nho nhỏ gắn ở góc trụ A và kính lái, là để kẹp số điện thoại của tài xế vào đó, trong trường hợp không có chỗ đậu, mình đậu tạm chỗ nào đó, đường chật hẻm nhỏ gì đó, nếu có xe cần đi qua, thì nhìn vào số điện thoại đã kẹp sẳn đó người ta sẽ gọi mình ra dời xe cho họ qua. Chứ không có số điện thoại kẹp ở đó thì biết tài xế ở đâu mà tìm.",positive
mg,zs,luxury,2025,suv,"Màu đen bóng, nhìn thể thao",positive
honda,hr-v,g,2025,suv,"Ngoại hình : HRV trông sang hơn, đỉnh đạc hơn Động cơ: HRV mạnh hơn Thương hiệu :Honda > Mitsubishi  Kết luận: ai cũng biết😊",positive
toyota,corolla cross,v,2024,suv,"nói gì nói, cross bản mới này nhìn đẹp thực sự",positive
hyundai,creta,n line,2025,suv,Vs bản thân em đang đi creta 2023 thì em thấy k thẩm đc ngoại hình của bản mới này! Hự hự chắc đc mỗi bộ mâm !,negative
skoda,kushaq,style,2025,suv,Chả ai hiểu biết lại đi mua cái xe vn lắp ráp.,negative
kia,seltos,,2024,suv,hay,positive
huyndai,accent,,2024,sedan,Con này bỏ cái Led chạy nagng đầu xe có khi đẹp hơn. Nhìn dãy Led nó cứ chuối chuối sao á,negative
vinfast,vf 6,plus,2025,suv,ko có màn vô lăng nhìn chối thật sự,negative
skoda,slavia,style,2025,sedan,con xanh nõn chuối độ đẹp thế có info ko bác,positive
geely,coolray,flagship,2025,suv,"Ghế da thật, không phải giả da rẻ tiền.",positive
skoda,kushaq,style,2025,suv,"Đã lái thử, kg có ấn tượng lắm",negative
skoda,kushaq,style,2025,suv,"Mình thấy con này thực dụng, thiết kế cũng oke mà, dịch vụ sửa chữa, thay thế oke nữa mình nghĩ nó sẽ có chỗ đứng",positive
byd,atto 3,,2024,suv,"Mình đã đi được 6 tháng gần 1v. Chưa thấy lỗi gì, vận hành mượt mà, cách âm rất tốt.",positive
toyota,vios,,2025,sedan,Ở VN có nhà máy sx khung gầm rồi. Tôi nghĩ chắc toyota sẽ ko thay đổi khung gầm ở VN đâu...! Chắc chỉ xe nhập mới dùng khung gầm daihatsu thôi.,neutral
mitsubishi,attrage,cvt,2024,sedan,"Nó gọi là xe tiêu thụ xăng ít đúng hơn là tiết kiệm. Xe nhẹ, lốp nhỏ, máy nhỏ mà 5.36 công bố. So với xe hạng D 1.6 tấn cũng trung bình chỉ 8L với lốp và máy rất to.",positive
vinfast,vf 6,,2024,suv,VF6 đẹp mắt nhất trong dàn ev nhà Vin,positive
skoda,kushaq,style,2025,suv,"con này khác gì em Huyndai Venue đâu :) e cũng vác đi Pù Luông qua Tân Lạc, Tà Xùa cũng được. Con này đc cái 6AT sẽ ổn định hơn DCT 7 Speeds!",positive
byd,seal 5,dm-i,2025,sedan,"Quá đúng luôn, dân VN đa phần chưa đi xe hybrid bao giờ nên cứ chê vì nó đắt và phát sinh chi phí nhiều hơn về sau. Hybrid ko phải để tiết kiệm mà để vận hành sướng hơn, sướng hơn thì phải vui lòng chấp nhận tốn kém hơn, ko thì cứ chịu khó giữ mình lạc hậu. BEV thì vận hành còn sướng hơn nữa nhưng gặp vấn đề trạm sạc và hãng xe trong nước nhiều trạm sạc nhưng sản phẩm lại còn nhiều khiếm khuyết. Nên xe hybrid là ổn nhất lúc này cho người dùng để nâng cao trải nghiệm vận hành.",neutral
geely,coolray,flagship,2025,suv,Ghế sưởi ấm mùa đông.,positive
skoda,slavia,style,2025,sedan,"Ngon, nhưng ít đại lý bảo hành quá",positive
