brand,model,version,year,segment,comment,label
byd,atto 3,,2024,suv,"nội thất đẹp, lạ thì cũng như một cô gái đẹp chỉ là ấn tượng va cảm xúc lúc đầu, còn quá trình sử dụng luôn có sự an tâm về trạm sạc, hậu mãi, bảo dưỡng, sửa chữa phụ tùng thay thế quan trọng hơn rất nhiều, nội thất đẹp, ấn tượng mà đi xe luôn có những nỗi lo về trạm sạc về ko biết hãng bao giờ rút khỏi VN... thì cũng mệt lắm.",neutral
hyundai,creta,n line,2025,suv,Nuốt luôn cửa sổ trời luôn bên nc bạn có về mình lại kín mất.,negative
mitsubishi,xforce,ultimate,2024,suv,Đợt VF9 đâm trên cao tốc nhìu ông vào chê có công nghệ tự phanh mà vẫn đâm. Nay coi clip này mới thấy chạy 70 là chỉ có tự mình bảo vệ mình thôi,negative
geely,coolray,flagship,2025,suv,Ngoại thất lỗi thời thật sự,negative
honda,city,1.5 rs,2025,sedan,City là trùm phân khúc rồi . Khỏi cần bàn,positive
nissan,kicks,e-powers,2025,suv,con này mà 6xx thì thôi ôi số 1,negative
skoda,slavia,style,2025,sedan,em này đúng là Volkswagen Virtus thay logo nên không có gì chê cả. Giá cả mọi thứ đều rất được,positive
byd,sealion 6,,2025,suv,Còn này khung gầm yếu. Còn bộ phân chia công suất nó mà hỏng thay gần 200tr :),negative
vinfast,vf 6,,2024,suv,"Đang nhắm em này, có lẽ năm sau sẽ chốt",positive
toyota,corolla cross,v,2024,suv,"Chỉ có fan cuồng Toy bị thuốc từ chục năm trc mới bảo Cross hơn thôi, còn so sánh mọi tiêu chí thì CX5 đều hơn",negative
toyota,corolla cross,v,2024,suv,"Chiếc này to xác hơn xforce nhưng ngồi thử hàng ghế sau cũng không rộng rãi và thoải mái hơn , thậm chí hàng ghế sau của xforce còn ngả được sâu hơn .",negative
toyota,yaris cross,máy xăng,2024,suv,Tôi cũng đi Yaris hv mới hôm qua đang lưu thông thì xe trước phanh đột ngột mà tôi hơi mất tập trung là xe tự động phanh ngay. Có trải qua vài lần như vậy mới biết Toyota họ làm xe tốt cơ nào,positive
mitsubishi,xforce,ultimate,2024,suv,"Chạy đến tốc độ 70km/h mới đụng nhẹ vào vật cản phía trước. Chứng tỏ, việc này cho thấy rằng: hệ thống an toàn chủ động phanh khẩn cấp của con xe này ngon hơn hệ thống phanh khẩn cấp của con xe Toyota Corolla Croos rồi. Trước đây thấy anh test hệ thống phanh chủ động của con Toyota Corolla Croos bản HV mà chỉ dám thử với tốc độ 30km/h thôi. Mình nghĩ, Corolla Croos chỉ bền về máy móc, khung gầm là hơn thôi. Còn về vấn đề đâm, đụng thì thua con xe này..",positive
toyota,vios,,2025,sedan,Mình cũng muốn mua vios cho bền mà còn tiết kiệm chi phí cho GD,positive
toyota,corolla cross,v,2024,suv,Cross thì ko có một chút vé vớt so với Tucson,negative
haval,jolian,,2025,suv,giờ xe tàu phải vừa ngon vừa rẻ là bình thường con nào chả thế đi khen xe tàu cũng hơi thừa cái tiền rẻ hơn đó cũng đi bù vào logo thôi,negative
toyota,corolla cross,v,2024,suv,"Đã thử 2 con cross và tuson đặc biệt cuối cùng chọn cross vì cái điều hòa. Mùa hè miền trung mà dùng tuson thì vừa đi vừa tức, xe gần 1tỷ mà điều hòa thì ko mát",positive
byd,atto 3,,2024,suv,Thiết kế ngoại thất mình thấy khá đẹp nhưng đối với mình thiết kế nội thất của BYD thật sự khó thẩm cực kì.,neutral
kia,seltos,,2024,suv,quả thắng tay kiểu này kho canh tranh Xforce,negative
byd,atto 3,,2024,suv,Xe ByD bây giờ chạy nhiều thật,positive
mg,5,std,2024,sedan,"Xe tàu này mà tiết kiệm nhiên liệu? Tất cả các loại xe tàu không có Xe nào tiết kiệm nếu so với các hãng khác ,đặc biệt khi 20 - 30 vạn thì nó còn ăn nhiều hơn nữa.",negative
skoda,kushaq,style,2025,suv,"Cầm Kushaq chạy Xuyên Việt hơn 1500km, thấy chiếc xe này rất đáng tiền trong phân khúc. Động cơ 7đ, hộp số 9đ, khung gầm 9đ. Đúng chất 1 chiếc xe Châu Âu, không hào nhoáng, thực dụng. Chạy bốc sướng, khung gầm chắc, trang bị an toàn vừa đủ, nhưng điều tử tế nhất là vẫn đủ 6 túi khí cho phiên bản rẻ nhất.",positive
kia,seltos,facelift,2024,suv,Ngáo giá quá,negative
toyota,vios,,2025,sedan,Thôi bó tay rồi. Đợi mãi mà thất vọng quá. Mua vf5 vậy,negative
skoda,kushaq,style,2025,suv,"mình có thấy nói mùi xe mới hơi khó chịu, chắc là do mùi keo chỉ chuyên ở việt nam nó vậy hả Tipcar, các xe khác như vios, vinfast fadil cũng có mùi này",negative
skoda,slavia,style,2025,sedan,"Đã cọc kushaq nhưng hôm ở gò vấp ngồi vào slavia thật sự có chút tiếc nuối 😅 sedan mà ngồi thoáng như cuv, bản full lại chỉ có 511 mới đau",positive
vinfast,vf 6,,2024,suv,Xe mình mua VF6 đang bị 1 lỗi chết người.Đó là đang di chuyển số D tự động nhảy về số P xe trôi tự do 2 lần liền.May không có xe phía sau nếu không thì cụ đi rồi.,negative
geely,coolray,flagship,2025,suv,Mình cũng như bạn có lẽ chọn theo bạn mua con này,positive
honda,city,1.5 rs,2025,sedan,"city RS anh test giữ làn thấy rõ vô lăng đánh lái nhẹ lại, đúng như xe Nhật, tinh tế và an toàn",positive
mg,5,std,2024,sedan,"Chạy gia đình thì được chứ dịch vụ thì thua, nó ăn xăng tương đương innova.vì xác xe hạng c khá nặng.",negative
mazda,cx-3,1.5 at,2025,suv,Đẹp có đẹp. Nhưng nội thất quá chặt.,positive
skoda,slavia,style,2025,sedan,Chưa mua xe. Nhưng thật sự thích Slavia. Các xe phân khúc Sedan B hầu hết có cảm giác mang tiếng xe chạy dịch vụ! Chạy Con Slavia ra đường cảm giác sang hơn 1 class 😂 giá lại ngang v mấy con B khác. Sắp tới có mua Sedan B chắc chắn mua e này,positive
byd,atto 3,,2024,suv,Nhìn đẹp thiệt . Treo đa điểm đi sướng lắm mọi người. Đi xa ít mệt. Phải chi giá 600 mấy là đớp liền,positive
toyota,corolla cross,v,2024,suv,"người lớn tuổi, lái xe lâu năm==> corolla cross;  Mua xe lần đầu, thanh niên, chị em phụ nữ===> CX5.  Cứ thế mà mua các bạn nhé. Hãng nó ko bán nhầm giá đầu, chỉ người mua nhầm mà thôi",neutral
skoda,slavia,style,2025,sedan,skoda bảo dưỡng sẽ cao hơn cùng phân khúc cỡ b,negative
skoda,kushaq,style,2025,suv,"Không bàn xấu đẹp và trang bị vì tùy nhu cầu từng người, nhưng mua Skoda là được mua đúng giá trị chiếc xe mang lại, sau hơn 1 năm với gần 30.000km với Kodiaq tôi chỉ dám nói ra được đúng câu đấy thôi, không có gì nhiều.",positive
skoda,kushaq,style,2025,suv,"Kushaq lắp được camera 360 rồi đó anh, em thấy các garage miền bắc miền nam đều đã làm được ạ, ai thích thì nâng cấp hihi.",positive
mg,zs,hybrid,2025,suv,Động cơ ổn đấy nhưng giá cao khó lắm vì xe trung quốc,negative
nissan,almera,,2024,sedan,Thích chiếc này nhưng không có cửa hàng ở gần,positive
nissan,almera,,2025,sedan,Cảm giác nó tử tế hơn xe của Honda nữa ấy. Thật kỳ lạ người Việt,positive
vinfast,vf 6,,2024,suv,Con này ế hay sao mà dạo này book quảng cáo nhiều thế =)) hàng 2 ngồi như ngồi xổm,negative
vinfast,vf 6,,2024,suv,"FV6 trang bị cao cấp hơn, cách âm tốt hơn và giảm sóc êm hơn. Còn rộng hơn không nhiều.",positive
mazda,cx-3,1.5 at,2025,suv,"chọn 10 lần vẫn cứ cx3 mà xúc nhé , ngoại hình nó hơn hẳn mà bảo m2 hơn dc thì tôi cũng ạ . Còn về phần đồ chơi thì tôi nói thật 2 con đó chả có gì với kiểu gì về chả lên màn android .",neutral
vinfast,vf 6,plus,2025,suv,600 triệu thì đúng với giá trị thực của xe,negative
toyota,vios,g,2024,sedan,giờ nội thất xe nhiều cái cứ phải cảm ứng cá nhân mình thì vẫn thích nút tương tác vật lí hơn,neutral
mg,5,luxury,2025,sedan,Tôi thích MG vì giá và chất lượng phù hợp,positive
skoda,slavia,style,2025,sedan,Bom tấn thực sự. Con này có lẽ lấn cấn nhất là 3 máy turbo luôn có độ trễ. Ngoài ra nên bỏ cửa sổ trời để đắp vào mấy cái khác sẽ phù hợp hơn.,neutral
haval,jolian,,2025,suv,Con này nếu không có yếu tố Trung Quốc thì ngon hơn cx5,positive
haval,jolian,,2025,suv,Xe tq thay giá vs cong nghe tot nhung k biet s vay năm ntn,positive
toyota,yaris cross,máy xăng,2024,suv,Yariss cross nhìn đẹp hơn,positive
skoda,slavia,ambiton,2025,sedan,"mong anh sớm ra video so sánh mẫu xe này với con city và vios, em thấy nó quá ngon trong tầm giá luôn",positive
skoda,kushaq,style,2025,suv,"Chỉ lo lỗi vặt thôi, lại ko có đại lí. Sale cứ nói vào huyndai đc, nhưng đấy là nó nói thế, yên tâm làm sao được. Trừ khi skoda nó làm luôn 1 gian phòng riêng ở các đại lí huyndai thì hay hơn. Chứ chờ mở đại lia lâu lắm. Không nhanh",negative
skoda,kushaq,style,2025,suv,"cái hỗ trợ cảnh báo điểm mù. Nhiều khi rất có hữu dụng với người đi đường nhé,mình đi xe máy nhiều khi thấy cái đèn trong gương nó sáng lên,chưa sở hữu ô tô nên k dám chắc ng lái xe sẽ thấy đén đấy như nào,nhưng bản thân thì biết là mình đang lọt vào điểm mù của chiếc ô tô đấy,nên sẽ chủ động đi tránh điểm mù đấy ra. Nó rất hữu dụng đấy,chứ k hẳn là vô dụng đâu",positive
toyota,vios,g,2025,sedan,"Trang bị thua city, accent... mà nói nhiều option nhất có sai ko nhỉ",negative
byd,atto 3,,2024,suv,"Ko thích tàu nhưng phải công nhận xe điện nó làm ngon vcl. Chạy thử mà phê lòi, cách âm như xe sang.",positive
toyota,vios,g,2025,sedan,Thùng tôn di động,negative
nissan,almera,,2024,sedan,"đẹp nhỉ, bản VL ra giấy cũng 6xx. Đáng cân nhắc đấy.",positive
skoda,kushaq,style,2025,suv,"Mình đã ra hãng chạy thử và chốt luôn, công nhận xe chạy bốc đầm chắc hơn xe Nhật, hàn nhiều",positive
skoda,slavia,style,2025,sedan,"Nhà đã có xe suv, cần thêm 1 cái để đi chợ quanh quanh cho tiện. Sau khi lái hết 1 loạt xe. Đã tính chốt CiTy, chuẩn bị cọc thì SLAVIA ra mắt, lái thử cái chốt lẹ. Giá hời, thực dụng, chắc chắn, đóng xe không kêu kiểu phòng phành, vào cua bám đường, điều hoà mát, hàng sau rộng ngồi 3 ng thoải mái (hôm lái thử nhà mình đi 4 ng thêm sale là 5) ngồi phê, cốp đúng cho mấy girl như tuiii. Nể 1 cái là lên vỉa hè không cần mớm thêm ga. 4 ng nhà tui lái thử ai cũng mê 🥰",positive
mg,5,std,2024,sedan,MG5 STD thêm KM vào lăn bánh có 500tr tội gì mà ko mua hihi,positive
honda,city,1.5 rs,2025,sedan,"vấn đề nằm ở giá bán thôi, đợt nào city nhảy vào top là đang chạy khuyến mại, còn hết đợt lại mất hút",positive
skoda,kushaq,style,2025,suv,"Xe škoda kushaq, ở bên Sec được đặt tên là Škoda Kamiq( hai xe này là sử dụng cùng 1 khung gầm, cũng giống như xe vw T-roc !!",neutral
byd,atto 3,,2024,suv,"xu thế là xe điện mà, nên nếu chất lượng và dịch vụ tốt thì hoàn toàn cạnh tranh quá OK chứ",positive
nissan,almera,,2025,sedan,Xe này đời mới nhìn đẹp thật sự,positive
kia,seltos,facelift,2024,suv,Mình đã trải nghiệm đời 2022 máy yếu phản hồi chậm chạy cao tốc ồn lắm.đc cái khung gầm chắc,neutral
mg,5,luxury,2025,sedan,Bản mới này nhìn ưng mắt hơn bản hiện tại nhiều luôn á,positive
vinfast,vf 6,eco,2025,suv,Sao hãng mãi không khắc phục được lỗi ve kêo đó ta . Xe ra cả 2 năm rồi,negative
huyndai,accent,,2024,sedan,"Cá nhân tôi không thẩm nổi thiết kế này,nhìn nữ tính",negative
huyndai,accent,,2024,sedan,Xe đẹp quá og anh,positive
skoda,kushaq,style,2025,suv,Xe châu âu giá tốt,positive
mg,zs,std,2024,suv,"Đã chạy con MG5, thấy hối hận, không ngờ con này cùng tầm giá, biết thế mua con này gầm cao chạy đường Việt Nam thì khỏe lưng hơn nhiều",positive
skoda,slavia,style,2025,sedan,Động cơ VW nhiều vấn đề đấy...!!,negative
mg,zs,hybrid,2025,suv,Trang bị ngon... Máy cũng quá ok lại thêm tính năng an toàn ADAS mà giá loanh quanh dưới 65p củ khoai thì bản 2025 này sẽ làm các hãng lớn đến từ Nhật Bản hay hàn quốc phải khóc thét,positive
skoda,kushaq,style,2025,suv,Họ làm xe tử tế. Quan trọng nhất điểm này,positive
vinfast,vf 6,eco,2025,suv,"Vf6 plus là đủ ngon để đi gia đình 4 người, độ ngả ghế sau thêm chút nữa là ngồi thoải mái",positive
byd,atto 3,,2024,suv,Nội thất nhìn sến súa,negative
skoda,kushaq,style,2025,suv,chơi đồ Wolk nhiều quá sửa chửa chi chắt phải đau ví lắm,negative
toyota,corolla cross,v,2024,suv,rất ok,positive
skoda,slavia,ambiton,2025,sedan,AT mà giá 475 thì còn gì để nói,positive
nissan,kicks,e-powers,2025,suv,"Mình ko ngại động cơ, hybrid nó có ở nước ngoài lâu rồi, nissan họ cũng làm tốt, mà tại xe xấu quá. 2025 mà về giá ko đổi như hiện tại thì xuống tiền liền",neutral
toyota,vios,,2025,sedan,"Nhìn bộ gió ra sau accent là thua rồi . Phải ra trước thì đẹp , giờ nhìn lại xấu hơn mấy chiếc xe cùng phân khúc nhiều . Còn thêm sài thêm công nghệ của anh ĐAI nữa , kiểu này chắc ĐAI luôn quá",negative
omoda,c5,,2024,suv,xe rất OK ngoại trừ cái tính năng sưởi ấm ghế kkkk,neutral
nissan,almera,,2024,sedan,"xe ngon chất lượng trên giá thành là quá tốt, bỏ tiền phải bỏ cho đáng với công sức mình bỏ ra chứ, mua mấy xe chất lượng bên trong cao như này,tiết kiệm như xe máy,lái ngon ,treo ngon trong tầm giá nhất rôi. ai đi mua mấy cái xe chỉ có mỗi nước sơn đẹp , chất gỗ thì kém",positive
huyndai,accent,,2024,sedan,accen mới tôi thấy đầu đẹp nội thất đẹp an toàn nhiều nói chung ok,positive
honda,city,1.5 rs,2024,sedan,đi lùi cẩn thận sụt gầm,negative
toyota,corolla cross,v,2024,suv,"Em này ở Nhật bán chạy như tôm tươi, có thời điểm không có xe để bán, khách phải chờ 4 tháng mới giao xe",positive
skoda,kushaq,style,2025,suv,mình đã chốt em nó bản style các bác ạ,positive
mitsubishi,attrage,cvt,2024,sedan,Con này vẫn thua i10 sedan về độ an toàn và cách âm,negative
haval,jolian,,2025,suv,Xe này tuổi so với CRV nha,negative
geely,coolray,flagship,2025,suv,Xin hy sinh cửa sổ trời để lấy cửa gió điều hoà ghế sau được không,negative
geely,coolray,flagship,2025,suv,thiết kế chưa thực sự cuốn hút. hết,negative
vinfast,vf 6,plus,2025,suv,Mới đầu cũng phân vân vf6 plus nâg cao và 7eco ( chênh nhau 40tr) . Nhưng khi lái thử 7eco cảm thấy 6plus nâg cao nó vẫn chiều người lái hơn. :D và đã chốt 6plus,positive
vinfast,vf 6,,2024,suv,"Bác so cách âm Vf6 thua các xe hạng B khác : như Creta hay seltos thì chịu rồi . 
K biết bác đi kiểu gì . 
VF6 mà k êm thì k có con nào hơn đc . Trừ Mec hoặc Ls 350",positive
toyota,vios,,2025,sedan,"Đi thử con yaris cross do Daihatsu đội lốt toyota làm mà cảm giác xe nó cứ rẻ tiền kiểu gì ấy. Khung gầm không chắc chắn đi qua gờ giảm sóc nó có tiếng lộc cộc lỏng lẻo, nhựa nội thất thì nhiều nhựa thừa mỏng với ọp ẹp, vỏ xe thì mỏng. Mất chất Toyota thật sự quá buồn. Vios năm nay mà vẫn Daihatsu làm thì hết thời là thấy rõ",negative
huyndai,accent,,2024,sedan,Nói chung xe Huyndai dịp này thiết kế quá rườm rà ko còn là hình thù của chiếc ô tô truyền thống.,negative
geely,coolray,flagship,2025,suv,xe tau khua,negative
skoda,kushaq,style,2025,suv,"Hãng skoda này mong sẽ định hình lại cách lựa chọn xe của thế hệ sau trẻ VN. Những cái bảo vệ bản thân gia đình như khung gầm, thân vỏ, túi khí, ADAS thì không ưu tiên, lại thích mấy cái màu mè như phanh đĩa, cửa nóc, chỉnh ghế. Còn phanh tay điện tử thì chấp nhận vì nó dễ thao tác hơn phanh tay cơ",positive
nissan,almera,,2025,sedan,"Tôi đã lấy bản V được hơn tuần, xe đi chẳng có gì để chê, tiết kiệm, cách âm tốt đi êm du.",positive
toyota,corolla cross,v,2024,suv,Đường dài mới biết ngựa hay. Chọn Toyota an tâm hơn.,positive
toyota,corolla cross,v,2024,suv,"900 lăn bánh thì cx5, tucson, outlander, territory thiếu đéo j con xe ngon",negative
toyota,corolla cross,v,2024,suv,"Bàn thờ táp lo làm thô bị nhô ra sau nhiều, đưa chân vào bị đụng đầu gối, cửa hàng ghế sau độ mở ít, ra vào xe rất khó khăn, mọi cái thì ok",negative
skoda,slavia,active,2025,sedan,"nhà mình 3ng làm ăn xa nên ko có dự định sẽ chở thêm ông bà ace gì nên cách đây 3 năm đã xuống tiền con mazda2, thể trạng 3 ng thì đều ở mức trung bình ng Việt mình. xem mấy con này thì ghiền thiệt nhưng vẫn rất hài lòng vs hiện tại kkkk",positive
toyota,vios,,2025,sedan,Con Daihatsu này về VN thì doanh số chắc chỉ ngang Atrage của Mis là cùng. Dấu chấm hết cho tượng đài,negative
mazda,cx-3,1.5 at,2025,suv,Tính ra lại hay mình đi toyota đời cũ toàn hỏng khu điều hoà nhất là cái gió trong gió ngoài,positive
mg,5,std,2024,sedan,Nội thất MG5 đúng đẹp mắt thật sự,positive
kia,seltos,,2024,suv,Tính năng an toàn kém so với giá và phân khúc,negative
geely,coolray,flagship,2025,suv,Khá tương đồng với Karoq nhưng mức tiêu thụ nhiên liệu thì gấp đôi Karroq.,negative
vinfast,vf 6,eco,2025,suv,"VF mua về chạy dịch vụ hợp , chấm hết",neutral
toyota,corolla cross,v,2024,suv,Tiền nào vải đó. Các cụ nói Ko sai. Ko có gì là ngon bổ rẻ. Xe nó chỉ cần hơn có 1 tí thôi đã khác rồi.,positive
vinfast,vf 6,,2024,suv,"Tìm xem hạng B con nào dc 200HP mà bác nói bình thường. Vs cái xe bác mượn có bị sao k mà đeo cách âm ngang vs Creta hay… , ở cần máy đo tui đi cũng thấy Vf6 ăn rồi.
Hệ thống treo Vf6 bác đi ít ng nên nó sẽ k phát huy dc , phải đi 3 ng thì nó sẽ êm , 
Xe thân vỏ dày thì phải chấp nhận k gian hơi hẹp lại .
Bác nên trải nghiệm và đánh giá lại cho chính xác",neutral
geely,coolray,flagship,2025,suv,Ghế trẻ em ISOFIX chuẩn.,positive
omoda,c5,,2024,suv,Xe k có chỗ nào chê mởi tội lại sx ở china,negative
skoda,slavia,style,2025,sedan,đẹp. tiếc k có phanh đĩa sau. khiến bánh trông trống rỗng,negative
huyndai,accent,,2024,sedan,Xe đẹp. Option ngon. Giá quá ổn,positive
hyundai,creta,n line,2025,suv,Con này đẹp,positive
mitsubishi,attrage,cvt,2025,sedan,Xe Nhật nên khách hàng tin tưởng tuyệt đối,positive
vinfast,vf 6,eco,2025,suv,"VF6S là lựa chọn tốt cho người lái, kiểu dáng hiện đại, đi thích. Nhưng nếu xét toàn diện nhất là nhu cầu gia đình thì còn nhiều điểm khiến mình phải lăn tăn.",positive
toyota,yaris cross,máy xăng,2024,suv,"Nếu có điều kiện thì mình nghĩ lên hrv, mặc dù ồn và đắt hơn. Còn ko thì nếu cân nhắc chi phí sử dụng lâu dài thì yaris cross vẫn ổn hơn",positive
skoda,slavia,style,2025,sedan,"Con này đáng mua đó chứ , thêm 1 lựa chọn rất tốt",positive
skoda,kushaq,style,2025,suv,Không ngon bằng geely coolray,negative
mg,zs,luxury,2024,suv,"1. Nguồn gốc theo tôi biết MG là xe Anh, giờ là chủ TQ, chứ ko có nguồn gốc TQ. Bác cần làm rõ chỗ này cho người xem.
 2. Độ ồn thì khẳng định cách âm tốt hơn Seltos ( cùng phân khúc ) đi đầm chắc hơn.
 3. Cửa đóng chắc nhất dòng cỡ B này, X Force toàn tôn mỏng thực sự nản
 4. Vị trí ngồi lái góc quan sát rất ok, tốt hơn X Force và Seltos rất nhiều. Nhất là X Force ngồi lái rất khó chịu
 5. Xe vào cua bẻ lái gắt có hiện tượng văng khá rõ nhưng cảm giác vẫn khá hơn các dòng cùng phân khúc
 6. Ghế êm, đi đường trường nhàn,5.3l/100km . Trong đô thị thì đúng là nhiều lúc trên 10l
 7. Tiếng cộc cộc qua gờ giảm tốc là rõ ràng, mới thì sẽ khá ổn kiểu pực pực, tầm 4v là cộc cộc
 8. Cần số lỏng lẻo, không chắc, cảm giác đây là chi tiết Tàu nhất trên xe, còn lại mọi thứ ok !
 9. Chất lượng còn cần thời gian kiểm định.
 => KL : với 600tr thì MG ZS là quá ổn cho 5-10 năm.",positive
skoda,kushaq,style,2025,suv,"Xe có đầy đủ những tính năng cốt lõi nhưng cần thêm 1 số cái thiết yếu. Phanh tay ĐT/HOLD vì liên tục sử dụng, đèn TĐ xa/gần đi đêm nhàn hơn rất nhiều, camera 360 nếu có sẽ hỗ trợ những lúc vào khu chật hẹp, HUD để luôn quan sát hạn chế bị quá tốc độ, nhận diện biển báo có thì quá hay lúc không kịp nhìn bảng . Có thể cắt bớt cửa sổ trời, ADAS thì không cần, để thêm những tính năng kia là vô cùng tuyệt vời cho người thích lái.",neutral
skoda,kushaq,style,2025,suv,"giá này vẫn lăn tăn
 giảm thêm 100tr thì sẽ suy nghĩ",negative
vinfast,vf 6,plus,2025,suv,Xe được cái mã đẹp chứ bên trong công năng quá xoàng. Vinfast ko biết thiết kế xe,negative
nissan,almera,,2024,sedan,Mình nhớ ngày xưa nhà mình chọn raize thay vì Almera là do con này không có khoá tỷ số truyền (số M). Dù là xe số tự động nhưng mình vẫn muốn có số M khi đi đèo. Không biết bản mới này có không?,negative
nissan,almera,,2024,sedan,Đi bản cũ rồi giờ nhìn bản mới vẫn thấy ngon,positive
mg,5,std,2024,sedan,công nhận con new mg5 này màu đen nhìn nét thật,positive
mazda,2,at,2025,sedan,"Nếu mình thì cũng chọn mazda 2, còn đã cố thì cố almera chứ không chọn city",positive
vinfast,vf 6,,2024,suv,"Vinfast nên trang bị bánh dự phòng thì sẽ thuận lợi hơn cho người sử dụng vì đường ở Việt Nam có rất đinh và thép xì rô. 
Vinfast nên xem xét lại vấn đề này.",negative
skoda,kushaq,style,2025,suv,Xe này 500 triệu thì ok,positive
mazda,cx-3,1.5 at,2025,suv,"Mua xe lần đầu, giá giờ rất tốt nên xúc không ae",positive
geely,coolray,flagship,2025,suv,"May mà lúc cân nhắc mua xe em không gặp anh, chứ gặp là anh rủ nhảy hố =]]",negative
toyota,corolla cross,v,2024,suv,đắt hơn gần 200tr thì mua yariss cross hơn,negative
byd,sealion 6,,2025,suv,Phải công nhận hãng xe tq họ làm đẹp thật. Khó có điểm chê về ngoại hình,positive
nissan,almera,,2024,sedan,woow,positive
toyota,vios,,2025,sedan,Gầm cao một tý nữa thì quá ok.,neutral
vinfast,vf 6,eco,2025,suv,Đợi con limogreen ra mà 7xx thì chắc con 6 này giảm giá,neutral
mazda,cx-3,1.5 at,2025,suv,Cái loại điều hoà tự động mà nhét vào màn hình cảm ứng còn dùng không sướng bằng điều hoà cơ của xpander.,negative
skoda,kushaq,style,2025,suv,"Bảo dưỡng đắt hơn xe Nhật, nhưng chất lượng đáng tin.",neutral
byd,sealion 6,,2025,suv,Nhin nội thất nó hoàn thiện đường kim mũi chỉ đẹp thật tầm tiền như nó xe Nhật xe hàn thua xa,positive
geely,coolray,flagship,2025,suv,ngon mà bị cái máy lạnh yếu,negative
mg,5,std,2024,sedan,Xe uống xăng,negative
mg,zs,luxury,2025,suv,"Cửa sổ trời lớn, thoáng đãng",positive
byd,atto 2,,2025,suv,"BYD tối ưu không gian xe khá tốt và nội thất chỉn chu thực sự, thích hợp để sử dụng cho gia đình.",positive
vinfast,vf 6,plus,2025,suv,"Xe chạy ok lắm nha,mấy anh. Mình mới mua hơn 1 tuần",positive
skoda,kushaq,style,2025,suv,"Tầm tiền đó, xe thương hiệu Châu Âu thì k có j để chê cả. Nhưng nsx nên để cả 4 phanh đĩa sẽ ok hơn. Cá nhân mình thấy phanh tang trống giờ nó cứ...phèn phèn sao ý",neutral
