brand,model,version,year,segment,comment,label
toyota,vios,,2025,sedan,"Ng trẻ h k thik vios, dịch vụ thì chuyển dần sang xe điện, nếu k thay đổi thì vios chấp nhận nhường miếng bánh cho xe khác thôi",negative
nissan,almera,,2024,sedan,Nhìn bản nâng cấp mà tiếc vì chốt bản cũ hơi sớm,positive
omoda,c5,,2024,suv,"Xe đẹp phết a, động cơ cũng khỏe. Mà bảo hành 10 năm thì đúng là ko còn gì để nói",positive
vinfast,vf 6,plus,2025,suv,"Gầm 6 plus 17 cm hơi thấp nhỉ, với có 1 điểu mình hơi khó hiểu, vf6 plus là xe đời mới nhưng 2 cái cổng sạc đằng sau nó lại là 2 cổng usb ???? Tại sao ko phải là 2 cổng type C hoặc ít nhất 1 cổng usb và 1 cổng type C, điện thoại thời nay đời mới toàn dùng type C to C thôi.",negative
geely,coolray,flagship,2025,suv,"Xe Tàu giờ làm tốt, cạnh tranh được với Hàn Quốc.",positive
honda,hr-v,l,2025,suv,Chỉ đáng giá khi tấm 750tr trở xuống giá lăn bánh thôi bên Thái Lan trang bị ngất ngây mà giá không cao còn về Việt Nam bị cắt hết vẫn giá đó thì không thể hiểu nổi,negative
honda,city,1.5 l,2025,sedan,"Bản L đáng mua nhất trong 3 bản, L có cữa gió hàng ghế sau, lẫy chuyển số, điều hòa tự động, 8 loa, ghế da, đề nổ từ xa...bản G không có.",positive
nissan,almera,,2025,sedan,"hộp số cvt nissan cực kỳ tệ, có thể nói là tệ nhất trong các hãng xe Nhật",negative
toyota,corolla cross,v,2024,suv,Tôi thấy con xe này mức giá đó chả có 1 cái gì đáng mua ngoài cái logo ?,negative
honda,city,1.5 rs,2025,sedan,"Dàn lốp sau nên nhô za 1chút thì nhìn xe sẽ khoẻ hơn,mong hãng xe điều chỉnh thêm ạ",negative
skoda,kushaq,style,2025,suv,"Mình chạy xe skoda ở châu âu, phải công bằng mà nói cùng phân khúc xe Nhật không có cửa, skoda nó hơi thô nhưng mọi chi tiết chắc chắn, tụi tây họ sử dụng rất mạnh chứ không nâng niu như người Việt mình, như vậy là phù hợp. Nếu ai thích sự vận hành, thực dụng, k quá hình thức option…thì chơi dòng này rất hay.",positive
honda,city,1.5 rs,2024,sedan,Cảm nhận cá nhân khi chạy thử rs. Xe ồn nhất phân khúc. Gương tù. Màn giải trí mờ mờ mịt và thô.chắc đc cái mã và cũng lành. Nhưng con này khuyến cáo đi nhẹ nhàng. Đi trâu bò dây đai toang.,negative
kia,seltos,facelift,2024,suv,"Mua năm ngoái giờ thấy ra bản mới đẹp nên cũng hơi tiếc. Nhưng bản cũ có cst, 1.6 at, ghế trắng trông sáng xe, giá ok nữa nên thôi cũng dc",positive
vinfast,vf 6,eco,2025,suv,"Đầu mấy con VF6 không đẹp, thấy mỗi VF8 là ưng",negative
vinfast,vf 6,eco,2025,suv,"Con này chỉ bị cái là hàng ghế sau ngồi khó chịu ra. Còn sức mạnh động cơ, chi phí, khung gầm thân vỏ vượt tầm giá. Ngồi trên xe không sợ bẹp dí như mấy thùng tôn Toyota khi có va chạm.",positive
toyota,vios,g,2024,sedan,Mình chạy 1 năm rùi .chạy yêm đi đã,positive
honda,city,1.5 rs,2024,sedan,city giảm giá cái lên top 1 hạng B luôn,positive
skoda,slavia,style,2025,sedan,nhìn đẹp quá,positive
skoda,slavia,style,2025,sedan,Chiếc này ngon mà nhiều đồ chơi hợp người trẻ phết :D,positive
vinfast,vf 6,eco,2025,suv,Vf6 bên châu âu thấp nhất 900 tr,neutral
skoda,kushaq,style,2025,suv,To cao rộng rãi không bằng xforce. Đẹp mắt hào nhoáng không bằng seltos. Thương hiệu và độ tin cậy chắc gì đã hơn nhật hàn họ làm ăn cả mấy chục năm nay ở Việt Nam. Mua được xe nhưng chăm chút cho nó cũng cả vấn đề. Đại lý ít. Đồ đạc ít. Mạnh dạn trả giá 450tr thì mua,negative
vinfast,vf 6,,2024,suv,Đã mua vf6 và rất hài lòng với lựa chọn của mình,positive
geely,coolray,flagship,2025,suv,Con này không ưng cái ngoại hình với không có cửa gió hàng ghế sau chứ tầm giá nó là best choice p/p rồi. MG ZS hơn cái mã ngoài và giá cũng như vào lâu hơn thôi.,negative
honda,hr-v,l,2025,suv,"pót chơ châu á này ổn áp, em có tiền là cũng muốn rước em nó ngay",positive
geely,coolray,flagship,2025,suv,Chắc bạn bằng tuổi admin nào đó ở 1 bên nào đó mới góp con VF6 khi chỉ có 1/3 tiền. Quan điểm sống khác biệt và cách bạn nói về lựa chọn của bạn đã thấy đẳng cấp khác hẳn rồi :D 1 sub 1 like cho bạn. Mình đang đi xe Nhật nhưng khi lái thử và sờ chạm 1 con xe Tàu thì thật sự bây giờ họ làm tốt thật. Dàn nhựa trong khoang xe có ọp ẹp thi thoảng phát ra âm thanh lỏng lẻo như nội thất mấy con hạng B Nhật không bạn?,positive
toyota,corolla cross,v,2024,suv,"Hàng ghế sau chật quá bác ạ. Ko hiểu sao nó làm cái cốp thì to, hàng ghế sau thì chật.",negative
omoda,c5,,2024,suv,Nhìn cái đầu xe thấy lỗ nhỗ kinh kinh kiểu gì ấy.,negative
omoda,c5,,2024,suv,Nhìn thoáng tưởng thiết kế nhà KIA,positive
geely,coolray,flagship,2025,suv,Thiết kế bodykit thể thao.,positive
honda,city,1.5 rs,2024,sedan,Trước kia mình vẫn nghĩ là hạng B sẽ đỡ ồn hơn hạng B. Nhưng tôi đã nhầm sau khi chạy fadil sau đó chuyển lên honda City. Ngoài độ ồn ra thì không có gì để chê khi nhu cầu chỉ đi loanh quanh đô thị.,neutral
kia,seltos,facelift,2024,suv,Thà giá cao nhưng chất lượng ngon như seltos chứ mua mấy con xe phải hạ giá vì bị chê thì biết chất lượng như thế nào rồi,negative
skoda,slavia,style,2025,sedan,5-6 km trên 100 cây,positive
vinfast,vf 6,plus,2025,suv,"Mình cũng đang đi VF6 Plus, mình đã thay phuộc tein cho hàng sau, lắp ốp pin, nâng cấp cốp điện, và rất hài lòng chiếc xe hiện tại. Chi phí sử dụng bằng 0, sức mạnh 201hp rất phù hợp với người trẻ, và full tính năng an toàn, đã giúp ích mình rất nhiều khi lái xe.",positive
skoda,kushaq,style,2025,suv,Mới xúc e nó. A tiến nói đúng và chuẩn tất cả. Trừ Nút chỉnh chiều cao lên xuống đèn pha chuk ko phải đọi sáng đèn taplo đâu a. Nó có thêm hốc làm lạnh ở cốp để đồ bên phụ. Bổ xung thêm. Cách âm khoang máy chưa ngon. Dội vô khoang khá nhiều từ 2 nghìn vòng đổ lên.,negative
nissan,almera,,2025,sedan,Tiếc quá xe này mà Nissan trang bị 4 phanh đĩa thì sẽ đẹp hơn cũng như sẽ làm hài lòng khách Việt hơn,neutral
omoda,c5,,2024,suv,Thêm quả ly hợp kép ướt thì ngon luôn,negative
byd,atto 3,,2024,suv,"Vấn đề vẫn là sự phổ cập trạm sạc nhanh. Chứ sạc tại nhà, nếu nhà thành phố có đủ diện tích lắp trạm sạc ở nhà chắc họ có sử dụng xe sang rồi và đôi khi họ có luôn chiếc thứ 2 nữa rồi. Vậy ai sẽ là đối tượng khác hàng tiềm năng BYD nhỉ",negative
skoda,slavia,active,2025,sedan,"Nghe ngon nhỉ, nhìn sịn mịn quá
 Vios city sẽ phải trông chừng. Đặc biệt hộp số tự động 6 cấp.",positive
honda,city,1.5 rs,2025,sedan,"Mình mua đc 2 tháng, cảm thấy oke",positive
byd,atto 3,,2024,suv,"đúng, con này khoang nội thất rộng hơn rất nhiều con vf6 @@",positive
toyota,corolla cross,v,2024,suv,Đắt hơn gần 200 củ đấy,negative
byd,seal 5,dm-i,2025,sedan,"nay đã lái thử,quá perfect..xe mạnh tăng tốc khỏe ,vượt bất cứ xe nào 1 cách dễ dàng.ngoại hình lại đẹp,xe rộng,dài..đi êm ,chắc chắn kể cả khi qua gờ giảm tốc",positive
toyota,corolla cross,v,2024,suv,"Đã mua Toyota corolla cross 2024 nhưng là bản HEV, chứ bản xăng thì mình đã không lấy vì có rất nhiều lựa chọn đáng cân nhắc hơn. Xe vận hành các thứ rất ok, hàng 2 hơi chật chút, gói an toàn trên con này chê cái ACC, ví dụ đang đi cao tốc set tốc độ 90km/h, xe phía trước giảm tốc nó giảm theo, nhưng khi ko có gì cản trở tốc độ đã set ở phía trước, nó ga lên rất mạnh sao cho đạt được tốc độ set, làm người lái sẽ hơi bị giật mình. Bản mới này không biết pô có cải thiện ko, hay lại như đời trước U4 mà cũng đã phải thay rồi",negative
nissan,almera,,2025,sedan,"Con này hay, máy 1,2 nhưng 3 máy thay vì 4 nên tọt đầu cũng rất tốt, cũng 3 máy như Attrage nhưng máy êm hơn rất nhiều.
 Còn nissan thì câu chuyện là hệ thống đại lý kém.
 Ngoài ra phụ tùng giá cao, một số chi tiết tháo lắp cũng loằng ngoằng hơn các hãng khác, nên cùng sửa 1 món nhưng mấy con nissan công thợ cao hơn",neutral
toyota,corolla cross,v,2024,suv,Mẫu xe dở nhất trong tầm giá...,negative
skoda,slavia,style,2025,sedan,Ko biết thực tế tiêu hao nhiên liệu là bao nhiêu ? Nhưng nghe đồn wolwagan mua lại thì ko ổn lắm . Chiếc xe viloran mới mua nè .thông số ghi tiêu hao 7-8 lit /100km nhưng thực tế đi hao đến 18-20 lit/100km . Lạy hồn.,negative
toyota,corolla cross,v,2024,suv,"Không hiểu sao mọi người có thể mua con corolla cross được , gần tỷ bé tí ọp à ọp ẹp",negative
toyota,yaris cross,máy xăng,2024,suv,"Xem 5 lần cuối cùng cọc xe Yaris vi có an toàn ga lúc đạp nhầm với phanh tự động cái này hữu ích với vợ 
 Còn mình thích chuyển số trên vô lăng và chi phí bảo dưỡng Toyota rẻ hợp lý",positive
huyndai,accent,,2024,sedan,lên 1.5 mình nghĩ là khoẻ hơn trc rồi chứ trc yếu thật có chải nhiệm thực tế thì rõ hơn,positive
honda,city,1.5 rs,2025,sedan,Quá đẹp chỉ còn giá cả thôi,positive
honda,city,1.5 rs,2025,sedan,Xe quá đẹp và nhiều công nghệ an toàn,positive
mitsubishi,xforce,ultimate,2024,suv,Đây là bản cao nhất phải k a còn bản thấp vs bản trung bình thì nó sẽ cho cảm giác như nào ạ,positive
honda,hr-v,g,2025,suv,conn này dáng rất đẹp bị thích quá mà nhiều cái an toàn lại thiếu giá tầm 550tr lắn bánh hơn 600 tí là đẹp,neutral
skoda,slavia,active,2025,sedan,Con này gập ghế hàng 2 mới hay màu trắng chay xe hoa khách cứ tưởng audi,positive
vinfast,vf 6,eco,2025,suv,Con 6s này có khuyến mãi giảm 100tr đúng là rất ngon bác nha,positive
skoda,slavia,style,2025,sedan,Doanh số sẽ thua vios và city hoặc ngang. Xe tốt giá tốt ngoại hình tốt,positive
vinfast,vf 6,eco,2025,suv,"Mình đang đi VF6+ , cảm giác đi rất thích, có mấy nhược điểm nhỏ, mua thêm phụ kiện về xử lý hết rồi . 
Xe mình hay đi xa liên tục, may mắn là chưa thấy bị lỗi gì , giờ phần mềm quá ổn định rồi, chưa phải tháo cọc âm bao giờ như các anh em mua xe đời đầu.
Cứ khởi động xe sau khi Vivi chào thì là ổn nhất, không bị lỗi nhé các bạn.",positive
mg,5,std,2024,sedan,Thôi tôi chịu ko mua Mg đâu,negative
huyndai,accent,,2024,sedan,Mẫu này mà có màu xi măng thì chắc đẹp nữa,positive
mazda,2,,2024,sedan,Thêm 2 cái râu ca lăng xaaud vl hết ý tưởng ak,negative
nissan,kicks,e-powers,2025,suv,"Ngang xe nhìn vẫn phò phạch như truyền thống của NS :D
 Cái màn hình nó làm tinh tế đấy chứ, nhiều con nhìn dày cộp.",negative
vinfast,vf 6,,2024,suv,Xe này dai them xiu nữa thì đẹp,negative
kia,seltos,facelift,2024,suv,Máy bằng con sonet mà ngáo giá thế,negative
byd,atto 3,,2024,suv,Vừa lái thử hôm kia . rất thích khung gầm qua giờ giảm tốc chắc nịch. đạp có sức kéo tốt. giá tiền / giá trị khá ngon . ngon hơn cx5. nhà có chỗ để xe và sạc tại nhà thì quá ngon,positive
mg,zs,luxury,2025,suv,"Màu xanh dương kim loại đẹp, hiếm trên đường",positive
mg,zs,luxury,2024,suv,Ngoại hình thì y sì đúc xe Mazda cx5,positive
vinfast,vf 6,eco,2025,suv,"Form Vf8, dáng, đầu Vf7, màn hình Vf9, gọn ngang ngang Vf5, vâng đó là VF6. Nhìn như mấy ông xe châu âu.",positive
haval,jolian,,2025,suv,"Xe ngon giá ngon, có cái Made In China . Lăng bánh cho 800 mấy, mình không thích Mazda mà phải nói là mua CX5 vẫn sẽ có nhiều người chọn.",positive
mg,zs,luxury,2024,suv,"Tất cả các xe dòng MG đều bị trễ chân ga nhiều thì phải, em lái thử các loại xe ở 1 lần MG tổ chức lái thử, lái thử xong hết muốn lái :D, cảm giác động cơ nó ko kéo được cái thân",negative
mazda,cx-3,1.5 at,2025,suv,"Mua xe gia đình thì chỉ 2vc 2 con nhỏ thì cạ vào đâu mà nhiều ông soi vl
Thi thoảng mới chở 5 người lớn, chứ ai mang xe dongf này đi lm dịch vụ 
Quan trọng xe đẹp bền giá ok minh thik là dc",positive
skoda,kushaq,style,2025,suv,Góc chữ A to quá,negative
nissan,kicks,e-powers,2025,suv,ở VN mà giá không đáng giá tầm tiền với Xffoce thì lại chết yểu :))))),negative
vinfast,vf 6,eco,2025,suv,Khung gầm do công nghệ của đức nên rất tốt,positive
mitsubishi,attrage,cvt,2024,sedan,Xe này ngon bổ rẻ có thật em đang chạy một chiếc,positive
geely,coolray,flagship,2025,suv,"Vậy thì tốn xăng vậy ta, mình đi cx-30 trong đô thị có 8.5l",negative
toyota,vios,,2025,sedan,Bền lành tiết kiệm phù hợp số đông,positive
honda,hr-v,g,2025,suv,"HRV mà thẩm mỹ châu Âu, Âu Lạc hả, lạy =]]] còn ông trên thì bảo đã thấy HRV ngoài đời mới hài cốt, làm như nó hàng hiếm ấy, khu nhà tôi nó chạy đầy đường như tôm như cá :)))) đáng giá cá nhân là chỉ có CRV đẹp thôi, còn HRV và BRV xấu, ko tới mức quá xấu nhưng nhìn thua mấy con Mazda, Seltos cả khúc :)))",neutral
vinfast,vf 6,eco,2025,suv,"Ngoài ra, thiết kế cột A của xe khá to, gây điểm mù lớn khi quan sát không thấy ai đề cập đến, nhưng mình thấy khá khó chịu.",negative
byd,sealion 6,,2025,suv,"màu ghế phèn thật, làm full đen còn đẹp hơn",negative
nissan,almera,,2024,sedan,đại lý nhiều thêm chút là ngon,neutral
toyota,yaris cross,máy xăng,2024,suv,Thích kiểu dáng của yaris Cross nhưng lại sợ xe của tyohatsu,negative
skoda,kushaq,style,2025,suv,"Thú thật chiếc này option tốt ko dở và nhãn Châu Âu nhưng vấn đề là phân khúc này thì xe TQ ngang giá kushaq lại có option nhiều hơn và bắt mắt nhiều hơn, nói chung kushaw sẽ rất khó ở VN đây😅",negative
byd,sealion 6,,2025,suv,"Ngoại thất mình thấy cũng khá ok rồi đó, nhưng cái nội thật của BYD mình không hợp lắm chỉ có con Han là mình thích nội thất thôi còn lại thấy nó ko hợp với mắt mình lắm. Công nghệ trên con này thì đúng là hay nhưng cần có thời gian để mình kiểm nghiệm thêm",positive
huyndai,accent,,2024,sedan,Phân khúc B giờ chỉ giành cho city và accent. Dấu chấm hết cho vios,positive
kia,seltos,facelift,2024,suv,kia ngáo giá,negative
vinfast,vf 6,plus,2025,suv,Sốp nhà quê thế. Vf6 plus có gạt mưa tự động thì đâu cần quan tâm đến gạt mưa như nào đâu :))). Bấm nút auto cho nó sáng lên là nó tự làm hết mà,positive
haval,jolian,,2025,suv,Thiết kế xe chưa tối ưu.,negative
huyndai,accent,,2024,sedan,"Điểm chê là phanh tay cơ,vô lăng 2 chấu nhìn xấu hơn 3 chấu ,tựa đầu phía sau chỉ có 2 cái thay vì 3 cái .còn lại thì cũng tạm ỗn",negative
mitsubishi,attrage,cvt,2025,sedan,"Ngoại thất mới nhìn sang hơn hẳn bản cũ, đèn LED đẹp lung linh buổi tối",positive
mazda,2,at,2025,sedan,"Con xe này đúng là bạch nguyệt quang của mình khi mua xe lần đầu đặc biệt ở bản luxury. Mọi cảm giác như sờ chạm và vận hành đều rất ưng ý, xe chủ yếu cho mình đi làm và chở vk đi chơi nên hàng sau không phải là vấn đề. Chỗ nào dùng nhiều chỗ đó đáng được ưu tiên. Bản AT thì bỏ ra tầm 30 củ độ lại ngon choét k cần phải đi xe hạng A. Đợt mua xe đắn đo mãi mà do bản luxury hết hàng nên lại quật Honda City",positive
mazda,2,at,2025,sedan,Mặt ca lăng hơi thô nhỉ,negative
vinfast,vf 6,,2024,suv,ngồi VF thấy vẫn kiểu an tâm hơn mấy con xe khác....,positive
huyndai,accent,,2024,sedan,"Nhà hàn chịu lắng nghe người tiêu dùng, thay đổi động cơ, điều hoà , chỗ ngồi, tay lái, … vv người Nhật nhất nhà Toyota sẽ phải theo , thôi, giờ xu hướng người trẻ mua xe nhiều,",positive
vinfast,vf 6,plus,2025,suv,Hàng hai ghế ngả tý nữa yên ghế rộng tý nữa thì tuyệt,negative
toyota,corolla cross,v,2024,suv,Rất mê Toyota,positive
geely,coolray,flagship,2025,suv,"bỏ hơn 600t ra mua cái xe tàu, ngooiif lên nhìn phèn vkl, chê",negative
vinfast,vf 6,eco,2025,suv,VF6 nhược điểm là phải về độ thêm mấy chổ ko vừa ý =))),negative
huyndai,accent,,2024,sedan,Có cửa sổ trời nữa là đẹp luôn,positive
mg,5,std,2024,sedan,"Giá MG5 giảm hơn 100 triệu,  giờ cạnh tranh luôn với xe hạng A.",positive
kia,seltos,facelift,2024,suv,Ngáo giá thật sự,negative
geely,coolray,flagship,2025,suv,"h xe Tàu ngon, muốn hưởng thụ giá rẻ xe TQ, bền Nhật, sang trọng châu Âu, mún đẩy xe hay chết cháy thì xe VN, xe Hàn thì thích oppa.",positive
skoda,slavia,style,2025,sedan,"Lăn tăn nhất là động cơ Turbo, sợ không bền bằng hút khí tự nhiên",negative
mg,5,std,2024,sedan,Dáng xe thì đẹp nhưng nói thương hiệu của trung quốc thì noi thật re hơn rứa tôi cũng ko mua thử nhất ko có thương hiệu và nhanh mất gia  va mấy cái đồ của trung quốc mấy năm đầu thui rồi sẽ bt,neutral
skoda,slavia,ambiton,2025,sedan,Lăn bánh bản full vẫn 575 khác méo gì city với accent,negative
mazda,cx-3,1.5 at,2025,suv,"hồi m đi tìm xe cho bx cx3 còn quá đắt. bản delux lăn bánh còn đắt hơn md3. nếu có bản at thì chắc chắn lấy rồi. rất thích cx3 vì nhỏ gọn, linh hoạt, lăn bánh 600tr cá nhân mình ko bh chọn mấy con kiểu raize, sonet, hay huyndai venue. mấy con ý pk cảm thấy nó rẻ tiền hơn hẳn",positive
byd,sealion 6,,2025,suv,Xe đẹp đi tiết kiêm nhưng to giá hơi cao niếu làm như phân khúc hang b như creta hay HRV khả năng bán chạy hơn hợp túi tiền tầm dân ngèo ở quê,negative
vinfast,vf 6,eco,2025,suv,Nhu cầu gia dình đi con này ok luôn,positive
mg,zs,luxury,2025,suv,"Máy mạnh, đi đèo không đuối",positive
mazda,cx-3,1.5 at,2025,suv,Xe này chật chội lắm bác ơi .,negative
toyota,vios,g,2024,sedan,Dấu Vios xấu lắm. Khó coi.,negative
skoda,slavia,style,2025,sedan,Thiết kế năm 2010.máy 1.0 giá trên đỉnh thì tốt máy cũng thành dõm ^^,negative
mg,zs,luxury,2025,suv,"Mâm 18 inch đẹp, lốp Michelin bám đường tốt",positive
byd,sealion 6,,2025,suv,Tôi thì tôi thấy kiểu byd thiết kế đầu xe mỗi con 1 kiểu nó khác nhau tí chứ ko phải như kiểu VinFast chung mẫu nhìn nó nhanh nhàm chán,positive
mitsubishi,attrage,cvt,2025,sedan,"Xe bền, chạy 300.000km vẫn nguyên zin",positive
skoda,kushaq,style,2025,suv,Cột A to va cái gương che het tầm nhìn,negative
toyota,corolla cross,v,2024,suv,"Cross: nhập Thái, bản toàn cầu chất lượng gia công đảm bảo
Cx5: ráp nội địa, chất lượng gia công thua xe toàn diện
Cross thì nhìn nó vẫn  chắc chắn hơn Cx5 nhiều",positive
byd,sealion 6,,2025,suv,"XE QUÁ ĐẸP, mỗi tội thương hiệu vẫn hơi ái ngại, nếu cân nhắc thì vẫn làm con inova hybrid hihi",neutral
mazda,cx-3,1.5 premium,2025,suv,Giá vậy mua Toyota Yaris Crocs ngon hơn nhiều,negative
mazda,cx-3,1.5 at,2025,suv,Đẹp,positive
skoda,kushaq,style,2025,suv,"đuôi xe ngắn quá, đuôi dài thêm tí thì đẹp",negative
toyota,vios,,2025,sedan,Daihatsu cung được ban 300tr lan banh thi mua luôn,neutral
toyota,vios,,2025,sedan,"Nản , khách giờ mua vios chủ yếu khung gầm , giờ khách hết mê",negative
mg,zs,std,2024,suv,"Xe yếu, hay hỏng vặt, thương hiệu Trung Quốc (ai bảo Anh Quốc là tui chửi nhé) nên thanh khoản thấp, hệ thống bảo hành rất ít rất khó khăn để sửa chữa.",negative
mazda,cx-3,1.5 at,2025,suv,300tr xứng đáng,negative
mazda,cx-3,1.5 luxury,2025,suv,"cách âm ko tốt, đi 4 người thì ok, cốp nhỏ, phù hợp gia đình nhỏ, bù lại dáng đẹp máy tiết kiệm xăng, nhà đang đi mazda 3 với cả cx3",positive
skoda,kushaq,style,2025,suv,Ai mê xe Đức mà ngân sách vừa phải thì Skoda là lựa chọn hợp lí,positive
toyota,vios,,2025,sedan,"Thật sự nói từ hồi học lái đến giờ toàn ngồi vios không. Phải nói vios là 1 cái gì đấy tiêu chuẩn, đáp ứng đủ, bền thì hên xui nhưng bảo dưỡng thay thế rẻ, điều hòa mát, sâu, mọi thứ đều ổn, đúng gà đẻ trứng vàng của toy.",positive
mg,5,std,2024,sedan,"Quá ok luôn, có tiền là chốt",positive
toyota,corolla cross,v,2024,suv,Thích nhất cross trong tầm giá đó.,positive
mg,5,std,2024,sedan,Mình gặp ngoài đường khoảng mấy lần. Với giá 379 đã ra biển tỉnh thì k có đối thủ,positive
geely,coolray,flagship,2025,suv,Nay mình thử lái 30p xuống tiền cọc luôn.,positive
toyota,corolla cross,v,2024,suv,Khác biệt hẳn daihatsu,positive
skoda,kushaq,style,2025,suv,Chưa bao giờ nghĩ xe châu Âu lại có giá hợp lý như Kushaq. Skoda làm tốt lắm,positive
skoda,kushaq,style,2025,suv,Treo cứng nhưng ổn định cao tốc.,neutral
geely,coolray,flagship,2025,suv,Taplo thiết kế ergonomics.,positive
skoda,slavia,style,2025,sedan,"con này tương lai giống Almera quá ,ngon chạy hay bền lành nhưng sẽ khó bán như Almera vì thương hiệu độ bao phủ đại lí .",positive
byd,atto 3,,2024,suv,"Không biết có nhìn nhận như mình không, tầm tiền quanh 700tr mình đang muốn mua xe điện, nhưng nhìn vf6 mình rất lấn cấn cái hàng ghế thứ 2. Độ ngã đứng có thể độ, nhưng cái độ dài mặt ghế nó cách rất xa mới tới được cái khuỷu chân, kèm thế ngồi bị xổm rất khó chịu. Muốn mua nhưng ngồi thật sự cảm thấy tội vợ con ghê. Nhìn qua byd kể cả con dolphin thôi, mà cái độ dài mặt ghế hàng 2 đã gần tới khuỷu, atto 3 thì rộng rải, sàn không bị xổm như vf. Thật sự vf cần cải tiến thiết kế trong nội thất khá nhiều, mới mang lại được cảm giác thoải mái cho một mẫu xe đi gia đình ở tầm giá này.",positive
geely,coolray,flagship,2025,suv,Taplo hiện đại.,positive
toyota,corolla cross,v,2024,suv,em đang chạy con này :)) ngoài cái treo ra và loa là loa jbl nữa thì quá tuyệt vời. đi phố rất lanh mà xăng cộ cũng chỉ uống tầm 8-9l đi phố. Nếu có nâng cấp được ghế phụ chỉnh điện nữa thì hết ý,positive
geely,coolray,flagship,2025,suv,Ghế điều chỉnh đa hướng.,positive
skoda,slavia,style,2025,sedan,ngon nhưng chắc ko ăn đc city,positive
omoda,c5,,2024,suv,"kể cho những cái khác nhau nhé: cam 360, ghế lái chỉnh điện 6 hướng, ghế phụ chỉnh điện 4 hướng, sưởi và thông gió ghế trc, lọc bụi pm 2.5, 8 loa sony, cửa sổ trời, cốp điện… và 1 số option khác. Đấy là những thứ bản thấp ko có. Làm xe mà khác nhau mỗi cái Adas thì có mà dở hơi à :))))",negative
skoda,kushaq,style,2025,suv,"Skoda đã chạy thử karoq thì thấy nó ngon, chắc nịch các sếp. Đừng so sánh xe châu Âu với Nhật chứ TQ",positive
skoda,kushaq,style,2025,suv,Chủ yếu là phụ tùng thay thế có giá Châu Âu ko thôi !,negative
toyota,vios,,2025,sedan,"Vios đi ngon mà, mình đi thấy rất khỏe nhé. Duy chỉ có nội thất hơi xấu, còn đâu rất thực dụng, tiện ích.",neutral
geely,coolray,flagship,2025,suv,Thương hiệu Geely mua Volvo.,positive
skoda,kushaq,style,2025,suv,1.5 4 máy khí tự nhiên là đẹp. 1.0 3 máy turbo nó cứ sao sao. Biết là mạnh nhưng lành thì 1.5 chắc sẽ lành hơn,negative
huyndai,accent,,2024,sedan,"accent ngày trước rẻ hẳn, bây giờ nâng cấp trang bị nâng cấp luôn giá rồi. cái đen nhất là city rs giảm giá bằng đúng accent thì người ta đi mua city hết rồi. xe nhật, adas đầy đủ, trên mạng mn khen nhiều",negative
vinfast,vf 6,plus,2025,suv,Ko biết ae cảm nhận như nào chứ em thấy ghế con VF 6 này ngồi phải nói là khó chịu vô cùng :(,negative
huyndai,accent,,2024,sedan,chốt Accent 2024,positive
